emotion,stems,lemmas,tweet,brand_product,hashtags
0,never seen mani head turn one point someon appl ask question reid hoffman,never seen many head turn one point someone apple asks question reid hoffman,Never seen so many heads turn at one point. Someone from #Apple asks a question to Reid Hoffman #SXSW,,"['#Apple', '#SXSW']"
0,podcast social busi summit011 austin listen new iphon delight,podcast social business summit011 austin listened new iphone delight,"Podcast on Social Business Summit 2011 AUSTIN {link} @mention @mention #sxsw , listened to it on my new Iphone ... delight !",iPhone,['#sxsw']
0,rumor appl open temporari store downtown austin ipad launch,rumor apple opening temporary store downtown austin ipad launch,RT@mention t's not a rumor: Apple is opening up a temporary store in downtown Austin for #SXSW and the iPad 2 launch {link},Apple,['#SXSW']
1,sit floor behind guy fondl new ipad disturb way,sitting floor behind guy fondling new ipad disturbing way,Sitting on the floor behind a guy who's fondling his new iPad 2 in a very disturbing way. #sxsw,iPad,['#sxsw']
0,sit ground wait ipad austin appl popup store geek,sitting ground waiting ipad austin apple popup store geek,Sitting on the ground waiting for my iPad at the Austin #apple popup store at #SXSW. What a geek I am.  {link},iPad,"['#apple', '#SXSW']"
0,window scarborough build corner 6th congress black appl pop store born weliveher,window scarborough building corner 6th congress blacked apple pop store born welivehere,Windows in the Scarborough building on corner of 6th &amp; Congress blacked out... an Apple pop-up store is being born! #sxsw #WeLiveHere,Apple,"['#sxsw', '#WeLiveHere']"
0,taken iphon ipad app grant realiz amaz app big applaus design dev,taken iphone ipad apps granted realizing amazing apps big applause designer devs,I've taken the SXSW iPhone and iPad apps for granted. Realizing just how amazing these apps are. Big applause to designers/devs. #SXSW,iPad or iPhone App,['#SXSW']
0,town sure check us use googl place foursquar kick ass deal foursquar googleplac,town sure check u using google place foursquare kick as deal foursquare googleplaces,Are you in town for #SXSW? Be sure to check in with us using Google Places and Foursquare for some kick ass deals! #foursquare #googleplaces,Other Google product or service,"['#SXSW', '#foursquare', '#googleplaces']"
0,fun w new check featur iphon see latest articl roll 4squar,fun w new check feature iphone see latest article roll 4square,Having fun w/ @mention new Check-In's feature on iPhone | See @mention latest article &quot;Roll your own 4square&quot; {link} #SXSW,iPad or iPhone App,['#SXSW']
0,mike tyson want iphon knockout cnet blog,mike tyson want iphone knockout cnet blog,Mike Tyson wants to be an iPhone knockout | #SXSW - CNET Blogs {link},iPhone,['#SXSW']
0,go today share photo video ireport cnn iphon app,going today share photo video ireport cnn iphone app,"RT@mention What's going on at #sxsw today? Share photos, video with iReport: {link} or through #CNN iPhone app!",iPad or iPhone App,"['#sxsw', '#CNN']"
0,fun googl analyt berkle topspin class use great info market music,fun google analytics berklee topspin class used great info marketing music,"Having fun with Google Analytics in our Berklee Topspin class !  If you haven't used it before, great info for marketing your music ! #SXSW",Other Google product or service,['#SXSW']
0,appl woke sandwich iphon ipad forgot much like geek spring break,apple woke sandwiched iphone ipad forgot much like geek spring break,Those aren't apples! RT @mention Woke up sandwiched between my iPhone and iPad. I forgot how much #SXSW was like geek spring break,iPhone,['#SXSW']
0,get ipad ye depress,get ipad yes depressed,"No, I didn't get an iPad 2 :( No, I'm not at #sxsw :( Yes, I am depressed :(",iPad,['#sxsw']
0,lol see singl pc user around macbook ipad web dev definit appl folk appl,lol see single pc user around macbooks ipads web devs definitely apple folk apple,"LOL, I don't see a single PC user around meÛÓjust Macbooks and iPads. Web devs are definitely Apple folks. #sxsw #apple",Apple,"['#sxsw', '#apple']"
0,group nice app group aber leider nur f r iphon,grouped nice app group aber leider nur f r iphone,"Grouped{in} nice app for groups, aber leider nur fÌ_r iPhone.  {link} #sxsw",iPad or iPhone App,['#sxsw']
0,ipad sync complet live livingthedream,ipad sync complete live livingthedream,iPad 2 sync complete! I'm live! #livingthedream #sxsw,iPad,"['#livingthedream', '#sxsw']"
0,test ncaa mmod ipad app session flawless livesteam bracket show ad atrix make sens mute though,testing ncaa mmod ipad app session flawless livesteam bracket show ad atrix make sense mute though,"Testing #NCAA MMOD iPad app during an #sxsw session. Flawless livesteam of bracket show. AT&amp;T ad for Atrix makes no sense on mute, though.",iPad or iPhone App,"['#NCAA', '#sxsw']"
1,grrr plancast stuff export googl calendar san diego pacif time shift central tme wack,grrr plancast stuff exported google calendar san diego pacific time shift central tme wack,Grrr..plancast stuff exported to Google calendar in San Diego/pacific time did not shift to central tme #wack #sxsw,Google,"['#wack', '#sxsw']"
0,cancel trip austin today weather found great itun mix artist free,cancel trip austin today weather found great itunes mix artist free,Had to cancel my trip to Austin #SXSW today/I'm under the weather. Found a great iTunes mix of SXSW artists &amp; it's FREE!{link},Other Apple product or service,['#SXSW']
0,includ emot thing ipad barrydil pnid,including emotional thing ipad barrydiller pnid,"We all, including me, have this emotional thing with iPad. #barrydiller #sxsw #pnid",iPad,"['#barrydiller', '#sxsw', '#pnid']"
0,jame franco go note speech ipad vs android vs world got ipad day ago feel like expert alreadi,james franco going note speech ipad v android v world got ipad day ago feel like expert already,James Franco is going over notes for his #SXSW speech iPad 2 vs Android Vs World. He got an iPad days ago but feels like an expert already.,iPad,['#SXSW']
0,crowley cashmor think ipad minor step tell peopl stand line appl pop store checkin,crowley cashmore think ipad minor step tell people standing line apple pop store checkins,Crowley and Cashmore think iPad 2 is a minor step up. Tell that to the people standing in line at #SXSW Apple pop-up store! #checkins,iPad,"['#SXSW', '#checkins']"
0,wow demand ipad insati seem sold everywher austin texa suppos town help,wow demand ipad insatiable seems sold everywhere austin texas suppose town helping,"Wow, demand for the iPad 2 is insatiable, seems to be sold out everywhere in Austin, Texas. I suppose #SXSW being in town isn't helping.",iPad,['#SXSW']
1,line around corner ipad2 say wait alreadi got two camera iphon sorri appl,line around corner ipad2 say wait already got two camera iphone sorry apple,"line around the corner for #iPad2 at #sxsw, i say wait on it. I've already got two cameras on my #iPhone sorry #apple",iPad,"['#iPad2', '#sxsw', '#iPhone', '#apple']"
0,anyon find makeshift appl store yet,anyone find makeshift apple store yet,Anyone find the makeshift #Apple store at #SXSW yet?,Apple,"['#Apple', '#SXSW']"
0,surround lot ipad box,surrounded lot ipad box,is surrounded by lots of iPad 2 boxes #SXSW,iPad,['#SXSW']
0,attende come see aquent booth 1415 trade show might win ipad,attendee come see aquent booth 1415 trade show might win ipad,SXSW attendees! Come see #Aquent booth 1415 #SXSW trade show. You might win iPad 2!,iPad,"['#Aquent', '#SXSW']"
1,bereft wander white cord limp lifeless outlet iphon poetri,bereft wanderer white cord limp lifeless outlet iphone poetry,"Bereft wanderer. White cord, limp. Lifeless. There is no outlet for your iPhone here. #sxsw #poetry",iPhone,"['#sxsw', '#poetry']"
0,hey vufind awesom new updat iphon app 3x speedup object tag outsid conf hour,hey vufinders awesome new update iphone app 3x speedup object tagging outside conf hour,"Hey #vufinders, awesome new update for @mention #iphone app {link} 3X speedup for object tagging (outside #sxsw conf hours :-)",iPad or iPhone App,"['#vufinders', '#iphone', '#sxsw']"
0,realli find enjoy ipad design principl well done tapworthi use clear point throughout,really finding enjoying ipad design principle well done tapworthy useful clear point throughout,Really finding myself enjoying the ipad design principles. Well done. #tapworthy Very useful and clear points throughout. #sxsw,iPad,"['#tapworthy', '#sxsw']"
0,googl find new way help small busi say place page overview,google finding new way help small business say place page overview,Google finding new ways to help small business say more on their Place Page #sxsw [Here's our overview {link},Google,['#sxsw']
0,googl hand free pi pi day win,google handing free pi pi day win,Google handing out free pi for pi day! #SXSW #win,Google,"['#SXSW', '#win']"
0,cant handl everyon tweet new flipboard jealou think take plung buy ipad,cant handle everyone tweet new flipboard jealous thinking taking plunge buying ipad,I cant handle everyone's tweets about the new Flipboard. #Jealous Thinking about taking the plunge and buying an iPad at #SXSW,iPad,"['#Jealous', '#SXSW']"
1,man panhandl ipad world come ipad appl tablet,man panhandling ipad world coming ipad apple tablet,Man panhandling for an iPad 2 at SXSW. WhatÛªs the world coming to? #iPad #apple #tablet #SXSW,iPad,"['#iPad', '#apple', '#tablet', '#SXSW']"
0,team android parti come tabl show us appolici app yr phone enter win nexu,team android party come table show u appolicious app yr phone enter win nexus,"At Team Android party, come by @mention table &amp; show us Appolicious app on yr phone to enter to win Nexus S! {link} #sxsw",Android,['#sxsw']
0,free android tshirt,free android tshirt,My free android tshirt #SXSW  {link},Android,['#SXSW']
0,domo iphon android app share facebook stranger via domo,domo iphone android app share facebook stranger via domo,Domo iPhone &amp; Android App: Share with Facebook Strangers {link} via @mention #DOMO #SXSW,iPad or iPhone App,"['#DOMO', '#SXSW']"
1,iphon app would b pretti awesom crash everi 10min extend brows fuckit illmakeitwork,iphone app would b pretty awesome crash every 10mins extended browsing fuckit illmakeitwork,This iPhone #SXSW app would b pretty awesome if it didn't crash every 10mins during extended browsing. #Fuckit #Illmakeitwork,iPad or iPhone App,"['#SXSW', '#Fuckit', '#Illmakeitwork']"
0,best iphon accessori rockstach techsmith istach via,best iphone accessory rockstache techsmith istache via,Best iPhone accessory of #sxsw {link} #rockstache #techsmith #istache /via @mention,iPhone,"['#sxsw', '#rockstache', '#techsmith', '#istache']"
1,iphon app awesom ipad app crash everi time,iphone app awesome ipad app crash every time,"SXSW iPhone app is awesome, but iPad app crashes every time. #sxsw",iPad or iPhone App,['#sxsw']
0,line ipad,line ipad,I'm in line for an #iPad 2 @mention @mention #SxSW,iPad,"['#iPad', '#SxSW']"
0,whoa line ipad2 3blk long appl austin,whoa line ipad2 3blks long apple austin,Whoa - line for ipad2 is 3blks long!!! #apple #Austin #SXSW,,"['#apple', '#Austin', '#SXSW']"
1,anyon address yeasay concert tonight googl map fail,anyone address yeasayer concert tonight google map failing,Does anyone have an address for the yeasayer concert tonight? Google maps is failing. #sxsw,Other Google product or service,['#sxsw']
0,anyon news ipad must cours,anyone news ipad must course,Does anyone have news from #SXSW? Other than the #iPad 2 is a must-have of course. {link},iPad,"['#SXSW', '#iPad']"
0,anyon know store still ipad stock,anyone know store still ipad stock,Does anyone know if the @mention store at #sxsw still has ipad 2's in stock?,iPad,['#sxsw']
1,ask one booth peopl appl paid everi singl booth show product ipad2 said idontbeliev,asked one booth people apple paid every single booth show product ipad2s said idontbelieve,I asked one of the booth people if #apple paid every single booth here to show their product on iPad2s. She said no. #idontbelieve #sxsw,Apple,"['#apple', '#idontbelieve', '#sxsw']"
0,one least help session leav session read ipad design note instead uxd,one least helpful session leave session read ipad design note instead uxdes,This is one of the least helpful sessions at #sxsw.  Leave this session &amp; read these iPad Design notes instead.  {link} #UXDes,iPad,"['#sxsw', '#UXDes']"
0,one three best app seen,one three best apps seen,This is one of the three best apps we've seen at #SXSW {link},iPad or iPhone App,['#SXSW']
0,everyon work googl geniu serious smart artist,everyone work google genius seriously smart artistic,is EVERYONE that works at google this genius??!?  Seriously smart AND artistic. #SXSW,Google,['#SXSW']
0,appl open pop store releas ipad quit scene geek power,apple opened pop store release ipad quite scene geek power,"Apple opened a pop-up store at #SXSW for the release of the iPad 2, and it was quite a scene. GEEK POWER! {link}",iPad,['#SXSW']
0,lone job protect ipad someon gotta,lonely job protecting ipad someone gotta,It's a lonely job protecting the iPad 2 but someones gotta do it.  {link}  #sxsw,iPad,['#sxsw']
0,thewildernessdowntown com best show googl thoma gayno like choreographi browser window,thewildernessdowntown com best show google thomas gayno like choreography browser window,Thewildernessdowntown.com Best of Show at SXSW. Google's Thomas Gayno:  &quot;it is like a choreography of browser windows&quot; #SXSW,Other Google product or service,['#SXSW']
1,internet blur ipad fade,internet blur ipad fade,"the internet blurs, {link} the iPad fades, {link} ÛÒ @mention at #SXSW",iPad,['#SXSW']
0,googl new rout around featur give 3 altern rout avoid traffic collect save driver yr day,google new route around feature give 3 alternate route avoid traffic collectively saving driver yr day,Google's new &quot;route-around&quot; feature gives 3 alternate routes to avoid traffic - collectively saving drivers 2 yrs/day #SXSW,Other Google product or service,['#SXSW']
0,new ipad app speech therapi commun showcas confer sxswi assistivetech,new ipad apps speech therapy communication showcased conference sxswi assistivetech,@mention New iPad Apps For Speech Therapy And Communication Are Showcased @mention #SXSW Conference {link} #sxswi #assistivetech,iPad or iPhone App,"['#SXSW', '#sxswi', '#assistivetech']"
0,new ipad app speech therapi commun showcas confer augcomm hcsm mhealth,new ipad apps speech therapy communication showcased conference augcomm hcsm mhealth,@mention New iPad Apps For Speech Therapy And Communication Are Showcased At The #SXSW Conference {link} #augcomm #hcsm #mhealth,iPad or iPhone App,"['#SXSW', '#augcomm', '#hcsm', '#mhealth']"
0,covet new ipad,covet new ipad,I covet #New IPad. {link} #SXSW,iPad,"['#New', '#SXSW']"
0,buy new ipad geekdat appl ipad2,buying new ipad geekdate apple ipad2,Buying 2 new iPad's with @mention #geekdate #apple #sxsw #ipad2,iPad,"['#geekdate', '#apple', '#sxsw', '#ipad2']"
0,googl new version map alreadi save pp 2yr time spent locat place sinc launch earlier week,google new version map already saved pp 2yrs time spent locating place since launch earlier week,"Google's new version of Maps has already saved pp 2yrs in time spent locating places, since launch earlier this week. #SxSW",Other Google product or service,['#SxSW']
0,random news tech exclus shot popup appl store tt ff,random news tech exclusive shot popup apple store tt ff,#random #news #tech exclusive shot of #SXSW popup Apple Store! {link} #TT #FF,Apple,"['#random', '#news', '#tech', '#SXSW', '#TT', '#FF']"
0,news lot ipad bash everyon want one even consist theme,news lot ipad bashing everyone want one even consistent theme,@mention news from #sxsw lots of iPad bashing but everyone wants one. Even @mention consistent with theme,iPad,['#sxsw']
0,wowwwwww next googl map amaz,wowwwwww next google map amazing,Wowwwwww next google maps is amazing! #sxsw,Other Google product or service,['#sxsw']
0,guy next use ipad periscop,guy next using ipad periscope,This guy next to me is using his ipad 2 as a periscope. #sxsw,iPad,['#sxsw']
0,sweet danfung denni demo immers video rig ipad platform use hell back parti,sweet danfung dennis demoing immersive video rig ipad platform used hell back party,Sweet. Danfung Dennis will be demoing the immersive video rig and iPad platform used in To Hell and Back Again at our #SXSW party.,iPad,['#SXSW']
1,interest googl look technic solut great commun human solut,interesting google look technical solution great community human solution,interesting &quot;@mention &quot;Google looks for technical solutions which why they're not great @mention community because its a human solution #SXSWÛ,Google,['#SXSW']
0,debat brand role publish enjoy heard googl doodl guy,debating brand role publisher enjoyed heard google doodle guy,At debating brands role as publishers #sxsw.  Enjoyed what I heard from the google doodle guys too.,Google,['#sxsw']
0,look forward panel tomorrow 5pm left brain search googl right brain search x,looking forward panel tomorrow 5pm left brain search google right brain search x,I'm looking forward to our panel tomorrow (5pm) at #SXSW: Left Brain Search = Google. Right Brain Search = X {link},Google,['#SXSW']
0,look forward smcdalla pre parti wed hope win ipad result shameless promot chevysmc,looking forward smcdallas pre party wed hoping win ipad resulting shameless promotion chevysmc,"I'm looking forward to the #SMCDallas pre #SXSW party Wed., and hoping I'll win an #iPad resulting from my shameless promotion.  #ChevySMC",iPad,"['#SMCDallas', '#SXSW', '#iPad', '#ChevySMC']"
1,tweet pretti non exist today thank iphon app fail hootsuit epic replac owllov,tweeting pretty non existent today thanks iphone app fail hootsuite epic replacement owllove,My tweeting from #sxsw been pretty non existent today thanks to the @mention iPhone app #fail - Hootsuite is the epic replacement! #owllove,iPad or iPhone App,"['#sxsw', '#fail', '#owllove']"
0,miss appl even open temporari store downtown austin say hope got passport,missing apple even opened temporary store downtown austin say hope got passport,"I'm missing out! Apple's even opened a temporary store in downtown Austin for it, says @mention Hope @mention got his passport? #SXSW",Apple,['#SXSW']
0,interest present build netflix iphon app,interesting presentation building netflix iphone app,Interesting presentation on the building of #Netflix iphone App at #sxsw {link},iPad or iPhone App,"['#Netflix', '#sxsw']"
0,interest googl analyt track offsit link virtual pg view use script moreknowledg mitharvard,interesting google analytics track offsite link virtual pg view using script moreknowledge mitharvard,Interesting RT @mention Google analytics can track offsite links as virtual pg views using Script. #moreknowledge #sxsw #mitharvard,,"['#moreknowledge', '#sxsw', '#mitharvard']"
0,well ipad realli perfect devic,well ipad really perfect device,Well having the iPad has really been the perfect device for #SXSW.,iPad,['#SXSW']
0,interest tidbit appl design ipad case design actual devic,interesting tidbit apple designed ipad case designing actual device,Interesting tidbit:  apple designed the iPad 2 case before designing the actual device.  #sxsw,iPad,['#sxsw']
0,go appl store aapl,going apple store aapl,Who's going to #SXSW?   Apple will have it's own store there....{link}  #AAPL,Apple,"['#SXSW', '#AAPL']"
1,go mock tech nerd come stand 4 hour line ipad rememb horror movi,going mock tech nerd coming stand 4 hour line ipad remembered horror movie,I was going to mock the tech-nerds for coming to #sxsw only to stand in a 4-hour line for an iPad 2. Then I remembered me and horror movies.,iPad,['#sxsw']
0,interest see yellow page ipad app come exampl good practic,interesting see yellow page ipad app come example good practice,Interesting to see Yellow Pages #iPad app come up as example of good practice #sxsw,iPad or iPhone App,"['#iPad', '#sxsw']"
1,start think blackberri like abacu phone damn u iphon want abacu,starting think blackberry like abacus phone damn u iphone wanted abacus,Is starting to think my #blackberry is more like the #abacus of phones. Damn u #iphone. #sxsw (I just wanted # abacus),iPhone,"['#blackberry', '#abacus', '#iphone', '#sxsw']"
0,ipad unload popup store awesom,ipad unloaded popup store awesome,#iPad being unloaded at #sxsw popup store. Awesome! {link},iPad,"['#iPad', '#sxsw']"
0,ipad loung free daili free coffe ipad art recharg refresh austin detail,ipad lounge free daily free coffee ipad art recharge refresh austin detail,"#iPad Lounge at @mention - Free daily for #sxsw - free coffee, #iPad #Art. Recharge. Refresh åÇ Austin Details {link}",iPad,"['#iPad', '#sxsw', '#iPad', '#Art']"
1,nice song hack write rail deliv sell work googl,nice song hack write rail deliver sell work google,"@mention Nice #SXSW song @mention  DonÛªt hack, Write Rails. Under deliver, over sell. Work for Google. {link}",Google,['#SXSW']
0,nice meet last night confess instal ipad realli like,nice meeting last night confession installed ipad really like,@mention Nice meeting you last night! Confession: I just installed @mention on my iPad &amp; really like it. :-) #SXSW,iPad or iPhone App,['#SXSW']
0,nice move appl center appl fanboy dom next week,nice move apple center apple fanboy dom next week,@mention Nice move on Apple #SXSW will be center of Apple fanboy-dom for the next week.,Apple,['#SXSW']
0,nice vid ipad hope behind camera,nice vid ipad hope behind camera,@mention nice vid on ipad 2 from #sxsw. Hope it was @mention behind the camera! {link},iPad,['#sxsw']
0,nice work organ appl pop store wish austin,nice work organizing apple pop store wish austin,@mention nice work on organizing the apple pop-up store - but wish you were here in #austin for #sxsw!,Apple,"['#austin', '#sxsw']"
0,googl deni launch major new social network circl includ tim reili say exist awesom,google denies launch major new social network circle including tim reily say exists awesome,"Google denies it will launch major new social network, Circles, at #sxsw. But some, including Tim O'Reily, say it exists and is, awesome!",Other Google product or service,['#sxsw']
0,appl open pop store cool anoth reason pissedimnotgoingtosxsw,apple opening pop store cool another reason pissedimnotgoingtosxsw,"Apple opening a pop-up store for #SXSW. Cool, and another reason I'm #pissedimnotgoingtosxsw. {link}",Apple,"['#SXSW', '#pissedimnotgoingtosxsw']"
0,appl open store downtown atx wknd time ppl buy ipad,apple opening store downtown atx wknd time ppl buy ipad,Apple opening a store in downtown ATX for this wknd ONLY.. same time as #SXSW so ppl can buy iPad 2. ÛÏ@mention {link},Apple,['#SXSW']
0,appl open downtown austin pop store even begin appl win,apple opening downtown austin pop store even begin apple win,"Apple opening downtown Austin pop up store for #SXSW. RT @mention Before It Even Begins, Apple Wins SXSW {link}",Apple,['#SXSW']
0,appl open pop store austin congress 6th sell new ipad,apple opening pop store austin congress 6th sell new ipads,Apple opening pop-up store in Austin at Congress and 6th to sell new iPads.  #sxsw  {link},iPad,['#sxsw']
0,appl open pop store austin phew begin panic thank steve,apple opening pop store austin phew beginning panic thanks steve,"Apple Opening Pop-Up Store In Austin For SXSW {link} - phew, I was beginning to panic, thanks Steve #SXSW",Apple,['#SXSW']
0,appl open pop store austin ya gotta hand appl alway innov appl,apple opening pop store austin ya gotta hand apple always innovating apple,Apple Opening Pop-Up Store In Austin For SXSW ~ {link} &lt;- Ya gotta hand it to Apple... always innovating #apple #sxsw,Apple,"['#apple', '#sxsw']"
0,listen get talib kweli via discovr app iphon plane love gogo,listening get talib kweli via discovr app iphone plane love gogo,I'm listening to 'Get By' by Talib Kweli via the Discovr app on my iPhone while I'm on a plane to #sxsw. Love Gogo.  {link},iPad or iPhone App,['#sxsw']
0,appl open temporari store downtown austin ipad launch,apple opening temporary store downtown austin ipad launch,Apple opening up temporary store in downtown Austin for #sxsw and the iPad 2 launch {link},,['#sxsw']
0,great even w karateka castl wolfenstein choplift appl classic oldsko0l,great evening w karateka castle wolfenstein choplifter apple classic oldsko0l,"Great evening w/ @mention + @mention Into Karateka, Castle Wolfenstein, ChopLifter and other Apple // classics. #SXSW #OldSko0l",Apple,"['#SXSW', '#OldSko0l']"
0,also thank appl releas io 4 3 time instal leav home,also thanks apple releasing io 4 3 time installed leaving home,"Also, thanks to Apple for releasing iOS 4.3 just in time for #SXSW. Installed it just before leaving home!",Apple,['#SXSW']
0,dan neumann announc launch organ first consum face ipad app broadfe check,dan neumann announced launch organic first consumer facing ipad app broadfeed check,"Dan Neumann just announced the launch of Organic's first consumer-facing iPad app, Broadfeed at #SXSW 
check it out!!",iPad,['#SXSW']
0,gonna want iphon app head today 10 hot one download away,gonna want iphone apps heading today 10 hot one download away,You're gonna want these iPhone apps if you're heading to #SXSW today. 10 hot ones. Download away! {link},iPad or iPhone App,['#SXSW']
0,mypov winner popup appl store chevi cruze loser investor prop frothi startup w enterpris strategi,mypov winner popup apple store chevy cruze loser investor propping frothy startup w enterprise strategy,"MyPOV: Winner: popup Apple Store, Chevy Cruze  Losers: Investors propping up frothy startups w/ no enterprise strategy. #sxsw",Apple,['#sxsw']
0,keep win shit thank killer ipad case,keep winning shit thanks killer ipad case,I keep winning shit! Thanks @mention for the killer iPad case. #sxsw,Other Apple product or service,['#sxsw']
