emotion,stems,lemmas,tweet,brand_product,hashtags
0,enjoy berkowitz talk rfid ncf impact mobil retail would carri nfc phone googl bullish ballroom e,enjoying berkowitz talk rfid ncf impact mobile retail would carry nfc phone google bullish ballroom e,"Enjoying Berkowitz talk about RFID and NCF...impact on mobile, retail. Would you carry a NFC phone? Google bullish #sxsw ballroom E",,['#sxsw']
1,best thing heard gave ipad money japan relief need ipad sxswgood,best thing heard gave ipad money japan relief need ipad sxswgood,@mention Best thing I've heard at #SXSW &quot;I gave my iPad 2 money to #Japan relief. I don't need an iPad 2.(@mention @mention #SXSWGOOD,iPad,"['#SXSW', '#Japan', '#SXSWGOOD']"
0,globalbestaward holler gram ipad itun store via ster great app madebymani,globalbestaward holler gram ipad itunes store via sters great app madebymany,RT globalbestaward Holler Gram for iPad on iTunes Store: {link} via @mention all you #SXSW-sters great App from #MadebyMany,iPad or iPhone App,"['#SXSW', '#MadebyMany']"
0,next big thing hmmm googl launch major new social network call circl possibl today,next big thing hmmm google launch major new social network called circle possibly today,"The next big thing? Hmmm. RT @mention Google to Launch Major New Social Network Called Circles, Possibly Today {link} #sxsw",Google,['#sxsw']
1,quotabl appl eleg fascist compani america flip board,quotable apple elegant fascist company america flip board,Too quotable --&gt; RT ÛÏ@mention &quot;Apple is the most elegant fascist company in America.&quot; #flip-board #SXSW,Apple,"['#flip', '#SXSW']"
0,blog ipad note next step hope great time,blogging ipad note next step hope great time,@mention blogging from your iPad notes the next step. Hope you are having a great time. #SXSW,iPad,['#SXSW']
1,somebodi write app let consist type shit goddamn iphon hey jump,somebody write app let consistently type shit goddamn iphone hey jump,Will somebody write an app that lets me consistently type &quot;SHIT&quot; on my goddamn iphone? Hey #sxsw ... jump on that.,iPhone,['#sxsw']
0,excit tomorrow leav austin 8am see googl 3 30pm still work schedul,excited tomorrow leaving austin 8am see google 3 30pm still working schedule,Excited about #sxsw tomorrow! Leaving for Austin at 8am. Will see Google's @mention at 3:30pm. Still working my schedule.,Google,['#sxsw']
0,talk ipad use develop nerd,talking ipad usefulness developer nerd,Talking about iPad's usefulness for developers. We're not nerds at all. #sxsw,iPad,['#sxsw']
0,redbul bpm dj ipad app power parti dta republ live,redbull bpm dj ipad app powering party dtas republic live,#redbull bpm DJ iPad app is powering this party. #sxsw #DTas   @mention Republic Live {link},iPad or iPhone App,"['#redbull', '#sxsw', '#DTas']"
0,come celebr w chariti water tonight googl throwin parti jump start week right studentsforcleanwat org rsvp,come celebrate w charity water tonight google throwin party jump start week right studentsforcleanwater org rsvp,Come celebrate w/ Charity Water tonight! (Google is throwin the party). Jump start your #sxsw week off right! studentsforcleanwater.org/rsvp,Google,['#sxsw']
0,googl lab fusion tabl made elect day foursquar visual possibl pr,google lab fusion table made election day foursquare visualization possible pr,Google Labs' Fusion Tables made Election Day Foursquare visualization possible #SXSW ^PR,Other Google product or service,['#SXSW']
0,late final gsdm googl great surpris b greet love lindsay stillman gonna b good night,late finally gsdm google great surprise b greeted lovely lindsay stillman gonna b good night,I'm late but finally here at #gsdm #google #SXSW great surprise to b greeted by the lovely Lindsay stillman. Gonna b a good night.,Google,"['#gsdm', '#google', '#SXSW']"
0,everyon buy app new ipad day birth happi happi gsdm,everyone buy app new ipad day birth happy happy gsdm,"Everyone buy @mention an app for his new iPad on this day of his birth. Happy, happy. #SXSW #gsdm",iPad or iPhone App,"['#SXSW', '#gsdm']"
1,buy ipad makeshift appl store launch day fuck respect much wwsxsw,buy ipad makeshift apple store launch day fuck respect much wwsxsw,"Should I buy an iPad for @mention at the makeshift #sxsw Apple Store on launch day? Fuck no, I respect him too much... #wwsxsw",iPad,"['#sxsw', '#wwsxsw']"
1,walk ladi bird lake love googl map travel time trust,walk lady bird lake lovely google map travel time trusted,"The walk by Lady Bird Lake was lovely, but Google Maps travel times are not to be trusted. #SXSW",Other Google product or service,['#SXSW']
0,law averag better buzz googl circl,law average better buzz google circle,"&quot;...by the law of averages, better than Buzz&quot; RT @mention &quot;Google Circles will be ______ &quot;  #sxsw",,['#sxsw']
0,iron tee usurp ipad hipster geek start chic fashion item year,ironic tee usurped ipad hipster geek start chic fashion item year,The ironic tee has been usurped by the iPad 2 as the hipster/geek/start-up chic fashion item at this year's #SXSW,iPad,['#SXSW']
1,ipad calendar frankeninterfac design one interfac metaphor use anoth tapworthi,ipad calendar frankeninterface designed one interface metaphor us another tapworthy,The iPad calendar = The Frankeninterface. Designed as one interface metaphor but uses another. #tapworthy #sxsw,,"['#tapworthy', '#sxsw']"
0,macallan formula success day good session ipad glass macallan singl malt,macallan formula successful day good session ipad glass macallan single malt,"#SXSW #macallan A formula for a successful day at SXSW - good sessions, my iPad, and a glass of MacAllan single malt. {link}",iPad,"['#SXSW', '#macallan']"
0,wait ipad also sale,wait ipad also sale,@mention Can not wait for #iPad 2 also. They should sale them down at #SXSW.,iPad,"['#iPad', '#SXSW']"
0,music locat mobil record meet io android updat time,music location mobile recording meet io android update time,"Music: Location, mobile recording, meet @mention - #ios and #android updates in time for #sxsw. {link}",,"['#ios', '#android', '#sxsw']"
1,enchant one use window voluntarili appl greatest collect egomaniac histori haha,enchantment one us window voluntarily apple greatest collection egomaniac history haha,#sxsw #enchantment: @mention &quot;No one uses Windows voluntarily.&quot; &quot;Apple is greatest collection of egomaniacs in history.&quot; haha,Apple,"['#sxsw', '#enchantment']"
1,enchant sell dream steve job say iphon 188 part made ppl suicid chines,enchantment sell dream steve job say iphone 188 part made ppl suicidal chinese,"#sxsw #enchantment: @mention &quot;Sell your dream. Steve Jobs doesn't say: iPhone is $188 of parts+AT&amp;T, made by ppl in suicidal Chinese",iPhone,"['#sxsw', '#enchantment']"
0,check free app festiv explor find band want see music tast,check free app festival explorer find band want see music taste,@mention check it. RT @mention #SXSW FREE App Festival Explorer: find the bands you want to see from your music tastes {link},iPad or iPhone App,['#SXSW']
0,check awesom dj skill ipad u,check awesome dj skill ipad u,@mention check out @mention awesome dj skills on the iPad while u are at #SXSW,iPad,['#SXSW']
0,check out011 south southwest interact iphon ipad must app site tool,check out011 south southwest interactive iphone ipad must apps site tool,"@mention Check out 2011 South by Southwest Interactive iPhone/iPad Must-have Apps, sites and tools by @mention {link} #SXSW",iPad or iPhone App,['#SXSW']
0,check eventseekr app launch keep updat parti android iphon app way,check eventseekr app launching keep updated party android iphone app way,@mention check out our #eventseekr app launching at #sxsw keep updated on parties. Android: {link} iPhone app on its way,Android App,"['#eventseekr', '#sxsw']"
0,check smyle android web group chat share locat media whiteboard thank app,check smyle android web group chat shared location medium whiteboarding thanks app,"@mention check out Smyle (for #Android and the web). Has group chat, shared location and media, and whiteboarding. Thanks. #SXSW #app",Android App,"['#Android', '#SXSW', '#app']"
0,check mistak made build netflix iphon go cool alway learn mistak,check mistake made building netflix iphone going cool always learn mistake,About to check out &quot;mistakes I made building Netflix for iPhone.&quot; this is going to be cool -you should always learn from mistakes. #sxsw,iPad or iPhone App,['#sxsw']
0,check latest stream appl store ipad2 come playsxsw,check latest stream apple store ipad2 come playsxsw,@mention Check the latest stream at Apple's store at #SXSW {link} . ipad2 here I come. #PLAYSXSW,iPad,"['#SXSW', '#PLAYSXSW']"
0,check latest stream appl store ipad2 wait playsxsw,check latest stream apple store ipad2 wait playsxsw,@mention Check the latest stream at Apple's store at #SXSW {link} . iPad2 wait for me  #PLAYSXSW,iPad,"['#SXSW', '#PLAYSXSW']"
1,launch pop appl store vintag store format mostli ipod snarki employe ah good old day,launched pop apple store vintage store format mostly ipod snarky employee ah good old day,"Just launched the pop-up Apple Store at #SXSW. It's our &quot;vintage&quot; store format: Mostly iPods and snarky employees. Ah, the good old days.",Apple,['#SXSW']
0,saveustechi panel get great start video surui carbon project googl,saveustechies panel getting great start video surui carbon project google,#saveustechies panel at #sxsw getting off to a great start with a video on the surui carbon project by google {link},Google,"['#saveustechies', '#sxsw']"
1,stupid technolog alway fail import time w iphon laptop blackberri thing work pen,stupid technology always fail important time w iphone laptop blackberry thing working pen,"Stupid technology! You always fail at important times! At #SXSW w/ an iPhone, laptop AND Blackberry and the only thing working is my pen.",iPhone,['#SXSW']
1,offici peopl use ipad take photo look weird,official people using ipad take photo look weird,It's official: people using the iPad 2 to take photos just look weird. #SXSW,iPad,['#SXSW']
0,offici present filmast iphon contest world best mobil app,official presenting filmaster iphone contest world best mobile apps,It's official: We'll be presenting #Filmaster for #iPhone in the contest of world's best mobile apps at #SXSW !!! {link},iPad or iPhone App,"['#Filmaster', '#iPhone', '#SXSW']"
0,offici buy ipad elev,official buying ipad elevate,It's official! I'm buying an iPad. #SXSW #elevate,iPad,"['#SXSW', '#elevate']"
0,pretti excit appl pop store come,pretty excited apple pop store coming,Pretty excited about the Apple Pop Up Store coming to #SXSW {link},Apple,['#SXSW']
0,pretti excit ipad session uxd,pretty excited ipad session uxdes,Pretty excited for @mention iPad session #uxdes #sxsw,iPad,"['#uxdes', '#sxsw']"
1,pretti excit iphon stop work,pretty excited iphone stop working,Pretty excited for my iPhone to stop working #sxsw #AT&amp;T,iPhone,"['#sxsw', '#AT']"
0,excit see hl dynam video ad insert tv everywher work ipad2 later today popup appl store,excited see hl dynamic video ad insertion tv everywhere working ipad2 later today popup apple store,We are excited to see HLS Dynamic Video Ad Insertion for TV Everywhere working on the #iPad2 later today at the #SXSW PopUp Apple Store,iPad,"['#iPad2', '#SXSW']"
0,ipad2 rock appl pop store,ipad2 rock apple pop store,#iPad2 rocks #SXSW (@mention Apple POP UP Store) {link},iPad,"['#iPad2', '#SXSW']"
0,first comput kid atari 800 kid first comput ipad abl,first computer kid atari 800 kid first computer ipad able,My first computer as a kid was an Atari 800; my kids first computer will be an iPad.  What will they be able to do that I couldn't? #sxsw,iPad,['#sxsw']
0,crowdbeacon put togeth guid latest updat iphon app go sick,crowdbeacon put together guide latest update iphone app going sick,.crowdbeacon has put together a guide to #sxsw at {link} The latest update to their iPhone app is going to be sick.,iPad or iPhone App,['#sxsw']
0,second day busi appl pop store appear trend vb appl store pic,second day business apple pop store appears trending vb apple store pic,"On its second day in business, the Apple pop-up store appears to be trending. #sxsw #vb (@mention Apple Store, SXSW) [pic]: {link}",Apple,"['#sxsw', '#vb']"
0,conf everyon mac ipad includ happen pc becom obsolet,conf everyone mac ipad including happened pc becoming obsolete,At #SXSW conf and EVERYONE has a Mac or Ipad (including me). What happened to the PC? Is it becoming obsolete?,iPad,['#SXSW']
0,congrat first ipad,congrats first ipad,@mention congrats on the first iPad 2 at #sxsw,iPad,['#sxsw']
0,congrat iphon app featur,congrats iphone app featured,@mention Congrats on your iPhone app being featured at #SXSW!,iPad or iPhone App,['#SXSW']
0,congratul win android award,congratulation winning android award,@mention Congratulations on winning the Android award! :) #sxsw,Android,['#sxsw']
0,congratul sent seesmic android phone,congratulation sent seesmic android phone,"@mention congratulations, sent from Seesmic on my Android phone, at #SXSW!",Android App,['#SXSW']
1,tri convinc watch launch googl social network know go comedi,trying convince watch launch google social network know going comedy,Trying 2 convince @mention 2 watch the launch of google Social network at #SXSW . I didn't know there was going to be comedy?!,Other Google product or service,['#SXSW']
0,cool mean watch ustream skyfir browser iphon safari work fun,cool mean watch ustream skyfire browser iphone safari work fun,"@mention Cool! That means we can watch Ustream in Skyfire browser on iPhone :-)
(Safari doesn't work) 
Have fun!  #sxsw",iPhone,['#sxsw']
0,could cool googl launch major new social network call circl possibl today,could cool google launch major new social network called circle possibly today,"Could be cool. RT @mention Google to Launch Major New Social Network Called Circles, Possibly Today {link} #sxsw",Other Google product or service,['#sxsw']
0,eat coolhau ice cream sandwich googl parti hmmm happi,eating coolhaus ice cream sandwich google party hmmm happy,"Eating a coolhaus ice cream sandwich at the Google party. Hmmm, happy. #sxsw",Google,['#sxsw']
0,realli could use one tini macbook air read appl set temporari store,really could use one tiny macbook air read apple set temporary store,I really could use one of those tiny MacBook Airs. Did I read that Apple set up a temporary store at SXSW? Where is it? #SXSW,Apple,['#SXSW']
0,crew rip android parti thank us droid,crew ripped android party thanks u droid,@mention crew ripped up Android party - thanks for having us Droid! {link} #sxsw,Android,['#sxsw']
1,data crunch crippl googl voic back regular text go,data crunch crippling google voice back regular texting go,The data crunch at #SXSW is crippling Google Voice. Back to regular texting we go...,Other Google product or service,['#SXSW']
0,new product idea pant built iphon charg dock built pocket,new product idea pant built iphone charging dock built pocket,new product idea: pants with a built in iphone charging dock built into the pocket! #sxsw,iPhone,['#sxsw']
1,true expect insidi approach like appl subscript disgrac librari,true expect insidious approach like apple subscription disgraceful library,"True,expect more insidious approaches, like Apple subscriptions. RT @mention {link} . Disgraceful.  #libraries #sxsw",Apple,"['#libraries', '#sxsw']"
0,bjdproduct even begin appl win tech,bjdproductions even begin apple win tech,"#bjdproductions Before It Even Begins, #Apple Wins #SXSW {link} #tech",Apple,"['#bjdproductions', '#Apple', '#SXSW', '#tech']"
0,secur guard enjoy ipad2 appl store austin,security guard enjoying ipad2 apple store austin,{link} Security guard enjoying the iPad2 at the Apple Store in Austin... #sxsw,iPad,['#sxsw']
0,unimit fingerprint secur scan itun ipad2 1990style,unimitated fingerprint security scan itunes ipad2 1990style,Unimitated - Fingerprint Security Scan - {link} #iTunes #ipad2 #1990style #SXSW,iPad,"['#iTunes', '#ipad2', '#1990style', '#SXSW']"
1,flipboard bldg app appstor need wholist mktg awar p r strategi drive adopt reli appl rji,flipboard bldg app appstore need wholistic mktg awareness p r strategy drive adoption rely apple rji,"#flipboard - when bldg app for AppStore, need wholistic mktg awareness, p.r. strategy to drive adoption Don't just rely on Apple. #rji #sxsw",,"['#flipboard', '#rji', '#sxsw']"
0,tech ipad get temporari appl store,tech ipad get temporary apple store,#tech iPad 2 Gets Temporary #Apple_Store for #SXSW {link},iPad,"['#tech', '#Apple_Store', '#SXSW']"
0,also ipad order stand line wast valuabl fellowship time,also ipad ordered stand line wasting valuable fellowship time,"Also, iPad 2 ordered. Now I don't have to stand in line, wasting valuable fellowship time. #sxsw",iPad,['#sxsw']
0,discov new convers icebreak hey new ipad ye social,discovered new conversation icebreaker hey new ipad yes social,"Discovered a new conversation icebreaker: &quot;Hey, is that the new iPad 2? Why yes it is...&quot; #SXSW #social",iPad,"['#SXSW', '#social']"
1,compos tweet acerb cynic ipad user phone crash dump app twitterpow imthatgood,composed tweet acerbic cynical ipad user phone crashed dumped apps twitterpower imthatgood,I composed a tweet so acerbic and cynical about ipad users that my phone crashed and dumped all my apps. #twitterpower #sxsw #imthatgood,iPad,"['#twitterpower', '#sxsw', '#imthatgood']"
0,wish ipad right last longer phone awkward laptop,wish ipad right last longer phone awkward laptop,Wish I had an iPad right now. Lasts longer than the phone and not as awkward as the laptop. #SXSW,iPad,['#SXSW']
0,could danger sweet appl listen us temp appl store near ipad2 launch,could dangerous sweet apple listened u temp apple store near ipad2 launch,That could be dangerous RT @mention Sweet...Apple listened to us!  A temp Apple Store near #SXSW for iPad2 launch!  {link},Apple,['#SXSW']
0,could first big news googl build new social framework,could first big news google building new social framework,This could be the first big news out of #sxsw... {link}  Google building new social framework.,,['#sxsw']
1,googl bing meet lover tiff last month seem disappointingli friendli,google bing meet lover tiff last month seems disappointingly friendly,Google and Bing meet at #SXSW after their lovers tiff last month but it seems to have been disappointingly friendly {link},Google,['#SXSW']
1,googl bing page rank panel ridicul crowd al franken justin timberlak,google bing page rank panel ridiculously crowded al franken justin timberlake,Google and Bing page rank panel is ridiculously crowded. Is Al Franken or Justin Timberlake here? #sxsw {link},Google,['#sxsw']
0,unexpect bonu wake 4am make flight order ipad right releas,unexpected bonus waking 4am make flight order ipad right released,Unexpected bonus of waking up at 4am to make #SXSW flight: being up to order iPad 2 right as it's released,,['#SXSW']
0,near field commun alreadi android phone bemyneighbor,near field communication already android phone bemyneighbor,Near Field Communication already here on android phones. #SXSW #bemyneighbor,,"['#SXSW', '#bemyneighbor']"
1,major ipad design flaw go ipad app stay open switch app ipaddesignheadach,major ipad design flaw go ipad app stay open switch apps ipaddesignheadaches,Major iPad design flaw: the SXSW Go iPad app. It doesn't stay open when you switch apps! #ipaddesignheadaches #sxsw,iPad or iPhone App,"['#ipaddesignheadaches', '#sxsw']"
0,head hear talk integr social network dynam team synergi got ipad readi go,headed hear talk integrated social network dynamic team synergy got ipad ready go,I'm headed down to #SXSW to hear a talk on integrated social network dynamics and team synergy.  I've got my iPad ready to go.,iPad,['#SXSW']
0,bore keynot use ipad draw pictur even good artist sxswi,bored keynote use ipad draw picture even good artist sxswi,"When bored during a keynote #sxsw, use your iPad to draw a picture - even if you are not a good artist!  {link} #sxswi",iPad,"['#sxsw', '#sxswi']"
0,brand focu trust zappo likabl virgin product appl recip success,brand focus trust zappos likability virgin product apple recipe success,Your brand focus? RT @mention 'Trust of Zappos + Likability of Virgin + Product of Apple' - recipe for success @mention #SXSW,Apple,['#SXSW']
0,brand focus purpos object surviv succeed googl search use info nike sneaker perform,brand focus purpose object survive succeed google search useful info nike sneaker performance,"When brand focuses on purpose, not object, they survive &amp; succeed. Google: not search, useful info. Nike: not sneakers, performance. #sxsw",Google,['#sxsw']
0,unexpect geekout moment far talk guy bring travel rpg iphon,unexpected geekout moment far talked guy bringing traveller rpg iphone,Unexpected geekout moment of #sxsw so far: talked with the guys who are bringing the Traveller RPG to the iPhone.,iPad or iPhone App,['#sxsw']
0,stood line 30 minut buy ipad appl pop store appl ipad austin fuckyeah,stood line 30 minute buy ipads apple pop store apple ipad austin fuckyeah,Only stood in line for 30 minutes to buy 2 iPads at the Apple pop-up store. #apple #sxsw #ipad #austin #fuckyeah,iPad,"['#apple', '#sxsw', '#ipad', '#austin', '#fuckyeah']"
0,sam lick rt got ipad cc,sam licked rt got ipad cc,"Sam licked it, so it's his! RT: @mention How I got an iPad 2 during #SXSW! {link} cc @mention",iPad,['#SXSW']
0,ad flight match peopl plane airport also download iphon app nice done,added flight matching people plane airport also downloaded iphone app nicely done,"Just added my #SXSW flights to @mention Matching people on planes/airports. Also downloaded the @mention iPhone app, nicely done.",iPad or iPhone App,['#SXSW']
0,found new mapquest iphon app turn turn gp free time check get reacquaint mq,found new mapquest iphone app turn turn gps free time check get reacquainted mq,Just found out new mapquest iPhone app has turn-by-turn gps for free... Time to check it out and get reacquainted with mq #sxsw,iPad or iPhone App,['#sxsw']
1,probabl put away android parti kinda embarrass iphon,probably put away android party kinda embarrassed iphone,You should probably put that away... RT @mention at the Android party and kinda embarrassed by my iPhone #SXSW,iPhone,['#SXSW']
0,make good sens appl set open popup shop core action via,make good sense apple set open popup shop core action via,makes good sense RT @mention Apple set to open popup shop in core of SXSW action {link} via @mention #SXSW,Apple,['#SXSW']
0,uber brand smart gonna move ton ipad2 appl open popup shop austin via,uber brand smart gonna move ton ipad2 apple opening popup shop austin via,UBER BRAND SMART: Gonna move a ton of iPad2 - #Apple opening a popup shop in Austin for #SxSW  {link} via@mention @mention,,"['#Apple', '#SxSW']"
0,localmind sound awesom locat base q could incred use iphon,localmind sound awesome location based q could incredibly useful iphone,#localmind sounds awesome.. location based Q&amp;A could be incredibly useful. {link} #iphone #sxsw,iPhone,"['#localmind', '#iphone', '#sxsw']"
0,heard appl open store downtown austin tomorrow sell ipad attende,heard apple opening store downtown austin tomorrow sell ipads attendee,Just heard that Apple is opening a store in downtown Austin tomorrow to sell iPads to #SXSW attendees.,Apple,['#SXSW']
0,interest hear differ googl buzz get readi word circl trend sxswi,interested hear different google buzz get ready word circle trending sxswi,Interested to hear how it's different from Google Buzz. RT @mention Get ready for the word &quot;Circles&quot; to be trending #SXSWi #SXSW :),Other Google product or service,"['#SXSWi', '#SXSW']"
1,annoy schedul app bad ui ipad finger fat,annoyed schedule app bad ui ipad finger fat,"So Annoyed with #SXSW schedule app that has bad #ui for iPad. My fingers ain't THAT fat, y'all.",iPad or iPhone App,"['#SXSW', '#ui']"
0,hear appl open temporari store via,hear apple opening temporary store via,{link} Did you hear? AppleÛªs opening a temporary store just for #SXSW! (via @mention,Apple,['#SXSW']
0,ballroom marissagoogl talk cool project obv love googl art project,ballroom marissagoogle talking cool project obv love google art project,ballroom d: #marissagoogle talking about some cool projects (obv). love the Google Art Project. #sxsw,Google,"['#marissagoogle', '#sxsw']"
0,pack charg ipad busi day weekend ahead also need download app iphon ipad,packed charging ipad busy day weekend ahead also need download apps iphone ipad,All packed! Charging the ipad for a busy day/weekend ahead. Also need to download the #SXSW apps for iphone/ipad!,iPad or iPhone App,['#SXSW']
0,ipad found friend jeff thank everyon help especi,ipad found friend jeff thanks everyone helped especially,"IPAD FOUND!!! My friend Jeff has it!!!! #SXSW thanks to everyone who helped, especially @mention",iPad,['#SXSW']
0,pack mani appl devic alarm set 5 15am see ya psych meet final mani guy,packed many apple device alarm set 5 15am see ya psyched meet finally many guy,All Packed. A few too many #Apple devices. Alarm set for 5:15am. See ya'll at #SXSW. Psyched to meet (finally) many of you guys!,Apple,"['#Apple', '#SXSW']"
0,first ipad2 sight interact infact everyon least 1 appl product use time,first ipad2 sighting interactive infact everyone least 1 apple product use time,First ipad2 sighting at #SXSW interactive - infact everyone has at least 1 Apple product in use at all times,,['#SXSW']
0,want ipad2 win,want ipad2 win,#want ipad2? Win it here: {link} #sxsw,iPad,"['#want', '#sxsw']"
0,download daili grape new app iphon take wine shop,download daily grape new app iphone take wine shop,Download Daily Grape  - a new app from @mention for the iPhone.  You can take him with you to the wine shop. #sxsw,iPad or iPhone App,['#sxsw']
