emotion,stems,lemmas,tweet,brand_product,hashtags
0,haha awesom rad ipad app hollergram via,haha awesomely rad ipad app hollergram via,"RT @mention RT haha, awesomely rad iPad app by @mention {link} #hollergram #sxsw (via @mention @mention)",iPad or iPhone App,"['#hollergram', '#sxsw']"
0,rt 150 million mobil user googl map 40 googl map usag mobil devic map,rt 150 million mobile user google map 40 google map usage mobile device map,"RT @mention RT: @mention With 150 million mobile users on Google maps, 40% of all Google Maps usage is from mobile devices. #maps #sxsw",,"['#maps', '#sxsw']"
0,rt rumor appl open temporari store downtown austin ipad launch,rt rumor apple opening temporary store downtown austin ipad launch,RT @mention RT: It's not a rumor: Apple is opening up a temporary store in downtown Austin for #SXSW and the iPad 2 launch {link},Apple,['#SXSW']
0,love appl come cool technolog one ever heard go confer,love apple come cool technology one ever heard go conference,RT @mention RT@mention Love it. @mention at #sxsw: &quot;apple comes up with cool technology no one's ever heard of because they don't go to conferences&quot;,Apple,['#sxsw']
0,rumor googl launch new social network call circl today sxswi,rumor google launching new social network called circle today sxswi,RT @mention Rumor of Google launching their new social network called #Circles today at #sxswi #sxsw {link},Google,"['#Circles', '#sxswi', '#sxsw']"
0,rumor appl store open 6th congress sign point ye,rumor apple store opening 6th congress sign point yes,RT @mention Rumors of an Apple store opening for #SXSW at 6th &amp; Congress. All signs point to yes! {link},Apple,['#SXSW']
0,save ipad2 photo appl store,saving ipad2 photo apple store,"RT @mention Saving up for iPad2 photo at Apple Store, #SXSW {link}  by @mention @mention @mention @Dr_Black @jerranalley @tbalinas",iPad,['#SXSW']
0,see member team carri one bag show wolfram app get w iphon case,see member team carrying one bag show wolfram app get w iphone case,"RT @mention See a member of our team carrying one of these bags at #SXSW, show them your Wolfram|App &amp; get a W|A iPhone case! {link}",Other Apple product or service,['#SXSW']
0,see new texa observ ipad app sxswi 3 30 sheraton,see new texas observer ipad app sxswi 3 30 sheraton,"RT @mention See the new Texas Observer iPad app at #SXSWI 3:30, Sheraton #SXSW",iPad or iPhone App,"['#SXSWI', '#SXSW']"
0,set pop shop smartest move ipad imho develop matter ipad,setting pop shop smartest move ipad imho developer matter ipad,RT @mention Setting up a pop up shop @mention #SXSW was the smartest move for the iPad IMHO  | Developers Matter the Most for iPad 2 -  {link},iPad,['#SXSW']
0,shut rumor appl open temp store downtown austin ipad launch,shut rumor apple opening temp store downtown austin ipad launch,RT @mention Shut. Up. RT @mention It's not a rumor: Apple is opening a temp store in downtown Austin for #SXSW &amp; the iPad 2 launch. {link},Apple,['#SXSW']
1,slide talk ipad design headach tapworthi realli interest design well,slide talk ipad design headache tapworthy really interesting designer well,"RT @mention Slides from #SXSW talk, &quot;iPad Design Headaches &quot; {link} #tapworthy . Really interesting for designers as well.",iPad,"['#SXSW', '#tapworthy']"
0,smart compani rumor appl open temporari store downtown austin ipad launch bit ly g03mzb,smart company rumor apple opening temporary store downtown austin ipad launch bit ly g03mzb,RT @mention Smart company. RT @mention It's not a rumor: Apple opening up a temporary store in downtown Austin for #SXSW &amp;iPad 2 launch bit.ly/g03MZB,Apple,['#SXSW']
0,smart appl open pop store austin peopl get new ipad bit ly i41h53 via,smart apple open pop store austin people get new ipads bit ly i41h53 via,RT @mention smart! Apple opens a pop-up store in Austin so people in for #SXSW can get new iPads. bit.ly/i41H53 (via @mention @mention,,['#SXSW']
0,smartphon breakdown unoffici 98 5 iphon 1 android 03 blackberri 02 symbian window,smartphone breakdown unofficial 98 5 iphones 1 android 03 blackberry 02 symbian window,"RT @mention Smartphone breakdown at #sxsw (unofficial) - 98.5% iPhones, 1% Android, .03% Blackberry, .02% Symbian / Windows / Other",iPhone,['#sxsw']
0,kickass iphon develop want someth cool follow shoot note,kickass iphone developer want something cool follow shoot note,"RT @mention So, are you a kickass #iPhone developer? Are you at #SxSW. Want to do something cool? Follow me and shoot me a note.",iPhone,"['#iPhone', '#SxSW']"
0,someon need host race sm app iphon pink slip probabl someth much cooler th,someone need host race sm apps iphone pink slip probably something much cooler th,RT @mention Someone at #SXSW needs to host a race between the SMS apps for iPhone pink slips. Or probably something much cooler th ...,,['#SXSW']
0,soundtrckr featur must,soundtrckr featured must,RT @mention Soundtrckr featured by @mention @mention as a Must-have for #SXSW {link},,['#SXSW']
1,speak truth watch appl staff temp store high five entir long line facepalm ugh longlinesbadux,speaks truth watched apple staff temp store high five entire long line facepalmed ugh longlinesbadux,RT @mention speaks truth: Watched #Apple staff at the temp #sxsw store just high five entire long line and facepalmed. Ugh. #LongLinesBadUX,Apple,"['#Apple', '#sxsw', '#LongLinesBadUX']"
0,spin play new concept music discoveri ipad spin com itun,spin play new concept music discovery ipad spin com itunes,RT @mention SPIN Play - a new concept in music discovery for your iPad from @mention &amp; spin.com {link} #iTunes #sxsw @mention,iPad or iPhone App,"['#iTunes', '#sxsw']"
0,spot man need ipad 2 sxswi,spotted man need ipad 2 sxswi,RT @mention Spotted at #SXSW: Man in need of an iPad (2?) ÛÒ {link} #sxswi,iPad,"['#SXSW', '#sxswi']"
0,still think awesom smileyparti go give ipad pleas,still thinking awesome smileyparty going give ipad please,RT @mention Still thinking about how awesome the  #smileyparty was at #SXSW and how they are going to give me an iPad! #please,iPad,"['#smileyparty', '#SXSW', '#please']"
0,stop let us make custom iphon case zazzlesxsw sxswi,stop let u make custom iphone case zazzlesxsw sxswi,RT @mention Stop by and let us make you a custom iPhone case! #zazzlesxsw #Sxsw #sxswi {link}  {link},iPhone,"['#zazzlesxsw', '#Sxsw', '#sxswi']"
0,strang littl japan news penetr bubbl bar tv cnn suggest anyth import ipad go fb,strange little japan news penetrates bubble bar tv cnn suggest anything important ipad going fb,RT @mention Strange how little Japan news penetrates #SXSW bubble. Only bar TVs on CNN suggest anything more important than iPad 2 is going on. #fb,iPad,"['#SXSW', '#fb']"
0,strong rumour abt googl unveil new social network call circl look interest,strong rumour abt google unveiling new social network called circle look interesting,RT @mention Strong rumours abt Google unveiling a new social network called 'Circles' at  #sxsw  Does look interesting: {link},Other Google product or service,['#sxsw']
0,sweet appl open pop shop scarbrough build congress ipad via,sweet apple opening pop shop scarbrough building congress ipad via,"RT @mention Sweet, Apple's opening a pop-up shop in the Scarbrough Building on Congress for the iPad 2 - {link} /via @mention #sxsw",Apple,['#sxsw']
1,sxsw011 novelti ipad news app fade fast among digit deleg,sxsw011 novelty ipad news apps fade fast among digital delegate,RT @mention SXSW 2011: Novelty of iPad news apps fades fast among digital delegates {link} #SXSW,iPad or iPhone App,['#SXSW']
0,get appl store atx,get apple store atx,RT @mention SXSW Gets Its Own Apple Store {link} #atx,Apple,['#atx']
1,temp appl store 6th st austin close night stuff say austin cop bar door,temp apple store 6th st austin closed night stuff say austin cop barring door,RT @mention Temp Apple Store 6th St  Austin #sxsw closed for night &quot;they're out of stuff' says Austin cops barring the door!,Apple,['#sxsw']
0,temp appl store kill austin sell earli everi day,temp apple store killing austin selling early every day,RT @mention Temp Apple store is killing it in Austin. Selling out early EVERY day. #sxsw,Apple,['#sxsw']
0,temporari appl store def tent powerhous gym,temporary apple store def tent powerhouse gym,"RT @mention Temporary #apple store is def not a tent, it's a powerhouse gym #SXSW  {link}",,"['#apple', '#SXSW']"
1,temporari appl store appl sneaki usual,temporary apple store apple sneaky usual,RT @mention Temporary #sxsw apple store. Apple being sneaky as usual  {link},Apple,['#sxsw']
0,thank pick book killer photo iphon sxswchi sxswi,thank picked book killer photoes iphone sxswchi sxswi,RT @mention Thank you! :) RT @mention Just picked up @mention book: Killer Photoes with your IPhone! #SXSW #sxswchi  {link} #SXSWi,iPhone,"['#SXSW', '#sxswchi', '#SXSWi']"
0,iphon app unreal click locat leanstartup person tell still seat,iphone app unreal clicked location leanstartup person tell still seat,RT @mention The @mention iPhone app is unreal. Just clicked on the location of #LeanStartup &amp; had a person there tell me there are still seats. #sxsw,iPad or iPhone App,"['#LeanStartup', '#sxsw']"
0,ipad take video sxswi,ipad take video sxswi,RT @mention The #iPad 2 Takes Over #SXSW [VIDEO] - {link} #sxswi,iPad,"['#iPad', '#SXSW', '#sxswi']"
0,ipad take video via mashabl appl,ipad take video via mashable apple,"RT @mention The #iPad 2 Takes Over #SXSW [VIDEO]: {link} via Mashable
#apple",iPad,"['#iPad', '#SXSW', '#apple']"
0,beluga iphon app highlight excel way coordin sxsw4japan relief effort,beluga iphone app highlight excellent way coordinate sxsw4japan relief effort,RT @mention The Beluga iPhone app is the highlight of this #SXSW. Excellent way to coordinate the #sxsw4japan relief effort.,iPad or iPhone App,"['#SXSW', '#sxsw4japan']"
0,big rumor googl launch ludicon base circl facebook killer supposedli alreadi saw ossum,big rumor google launch ludicon based circle facebook killer supposedly already saw ossum,RT @mention THE BIG #SXSW RUMOR: Google to launch ludicon based &quot;Circles&quot; facebook killer. Supposedly @mention already saw it and it's ossum.,Other Google product or service,['#SXSW']
0,day bank america launch iphon app got50k new custom bankinnov,day bank america launched iphone app got50k new customer bankinnovation,RT @mention The day Bank of America launched their iPhone app they got 250k new customers #bankinnovation #SXSW,,"['#bankinnovation', '#SXSW']"
1,futur network data googl may win long term web3 saatchini,future network data google may win long term web3 saatchiny,"RT @mention the future is about networks, not just data. that's why google may not win long term #SXSW #web3 #SaatchiNY",Google,"['#SXSW', '#web3', '#SaatchiNY']"
0,googl aclu parti tonight best thing ever appar spazmat franchis band rock,google aclu party tonight best thing ever apparently spazmatics franchised band rock,"RT @mention The Google / ACLU party tonight at #sxsw is the best thing ever. (And apparently, the Spazmatics are a franchised band. But they rock.)",Google,['#sxsw']
0,ipad goe sale next friday austin appl store go busi,ipad go sale next friday austin apple store going busy,RT @mention The iPad 2 goes on sale next Friday...the Austin Apple Store is going to be busy! #SXSW,iPad,['#SXSW']
0,ipad thin could use cut line cocain facetim mel gibson win ipad2,ipad thin could use cut line cocaine facetime mel gibson winning ipad2,"RT @mention The iPad 2 is so thin, I could use it to cut lines of cocaine and then FaceTime with Mel Gibson. #Winning. #IPad2 #sxsw",iPad,"['#Winning', '#IPad2', '#sxsw']"
1,ipad also cartoonishli larg digit camera csteja,ipad also cartoonishly large digital camera cstejas,RT @mention The iPad 2 is the also a cartoonishly large digital camera. #SXSW #CStejas {link},iPad,"['#SXSW', '#CStejas']"
0,ipad take video one biggest event first day sxsw011,ipad take video one biggest event first day sxsw011,RT @mention The iPad 2 Takes Over #SXSW [#VIDEO]: One of the biggest events the first day of SXSW 2011Û_ {link},iPad,"['#SXSW', '#VIDEO']"
0,ipad take video,ipad take video,RT @mention The iPad 2 Takes Over #SXSW [VIDEO] {link},iPad,['#SXSW']
0,iron tee usurp ipad hipster geek start chic fashion item year,ironic tee usurped ipad hipster geek start chic fashion item year,RT @mention The ironic tee has been usurped by the iPad 2 as the hipster/geek/start-up chic fashion item at this year's #SXSW,iPad,['#SXSW']
0,valuabl devic far appl ipod iphon charger,valuable device far apple ipod iphone charger,RT @mention The most valuable device at #sxsw so far is the #apple #iPod #iPhone charger.,Other Apple product or service,"['#sxsw', '#apple', '#iPod', '#iPhone']"
0,new whrrl app live iphon app store android marketplac get hot time,new whrrl app live iphone app store android marketplace get hot time,RT @mention The new Whrrl app is now live in the iPhone app store AND Android marketplace. Get it while it's hot! (Just in time for #SXSW!),iPad or iPhone App,['#SXSW']
0,next fin serv battl vs appl goog mobil oper consum loyalti ton cash vs bank bankinnov,next fin serv battle v apple goog mobile operator consumer loyalty ton cash v bank bankinnovate,"RT @mention The next fin serv battle is vs Apple, GOOG, Mobile operators. They have consumer loyalty and tons of cash (vs. Banks) #bankinnovate #SXSW",Google,"['#bankinnovate', '#SXSW']"
0,hand judg pop store constant line appl ipad2 clearli break,hand judging pop store constant line apple ipad2 clearly breaking,"@mention on the other hand, judging by the pop-up store constant line, Apple and the iPad2 are clearly breaking out at #SXSW",iPad,['#SXSW']
0,everyon plane austin look like go mean appl product hipster cloth,everyone plane austin look like going mean apple product hipster clothes,Everyone on the plane to Austin looks like they are going to #SXSW. And that means - Apple products and hipster clothes.,Apple,['#SXSW']
0,session designingforkid chang mind futur kid relationship iphon sapient,session designingforkids changing mind future kid relationship iphone sapient,RT @mention The session #designingforkids is changing my mind about my future kid's relationship with the iPhone. #sapient #sxsw,iPhone,"['#designingforkids', '#sapient', '#sxsw']"
0,build success googl buzz doubt googl launch circl social network,building success google buzz doubt google launch circle social network,building on the success of Google Buzz no doubt ;) RT @mention Google to launch Circles social network at #sxsw? {link},Other Google product or service,['#sxsw']
0,top 7 thing love far outbrain ipad groupm,top 7 thing loved far outbrain ipad groupme,"RT @mention The Top 7 things I've loved about #SXSW so far- {link}  #outbrain, #ipad, #groupme,",,"['#SXSW', '#outbrain', '#ipad', '#groupme']"
0,upsid start today ipad releas,upside start today ipad release,@mention On the upside.... #SXSW does start today and the iPad 2 releases...,iPad,['#SXSW']
0,web design guid io android app today 10,web designer guide io android apps today 10,"RT @mention The Web DesignerÛªs Guide to iOS (and Android) Apps, today @mention 10 a.m! {link} #sxsw",,['#sxsw']
0,iphon app keep groov sxsw011,iphone apps keep grooving sxsw011,RT @mention These iPhone apps will keep you grooving at #SXSW 2011 | @mention {link},iPad or iPhone App,['#SXSW']
0,everywher crazi look around realiz last year one ipad,everywhere crazy look around realize last year one ipad,RT @mention They are everywhere: It's just crazy to look around sxsw and realize last year no one had an iPad. #sxsw,iPad,['#sxsw']
0,googl 4 peopl work 7 peopl rather 7 peopl work 4 agileag,google 4 people work 7 people rather 7 people work 4 agileagency,"RT @mention This -&gt; RT @mention At Google, 4 people do the work of 7 people rather than 7 people doing the work of 4. #agileagency #SXSW",Google,"['#agileagency', '#SXSW']"
0,articl good link iphon train,article good linking iphone train,RT @mention This @mention article about #SXSW is so good I'm linking to it on an iPhone on a train: {link},iPhone,['#SXSW']
1,group next 6 ppl tabl everyon use thier phone ipad instead take,group next 6 ppl table everyone using thier phone ipad instead taking,RT @mention This group next to me has 6 ppl @mention the table. Everyone is using thier phone/ipad instead of taking to each other. #SXSW,iPad,['#SXSW']
0,awesom got ipad via,awesome got ipad via,RT @mention This is awesome....   How I got an iPad 2 during #SXSW! {link} @mention via @mention,iPad,['#SXSW']
0,one three best app seen,one three best apps seen,RT @mention This is one of the three best apps we've seen at #SXSW {link},iPad or iPhone App,['#SXSW']
0,social technolog amaz googl set person finder english japanes,social technology amazing google set person finder english japanese,RT @mention This is why social technology is amazing: Google has set up a Person Finder in both English and Japanese: {link} #SXSW,Google,['#SXSW']
0,thrill former chief talent offic appl gap advisori board sxswi innotrib,thrilled former chief talent officer apple gap advisory board sxswi innotribe,RT @mention Thrilled to have former Chief Talent Officer of Apple and Gap on @mention Advisory Board {link} #sxsw #sxswi #innotribe,Apple,"['#sxsw', '#sxswi', '#innotribe']"
0,tim soo invis instrument jaw drop iphon wii control openexhibit,tim soo invisible instrument jaw dropping iphone wii controller openexhibits,RT @mention Tim Soo's invisible instruments are jaw dropping. iPhone+Wii controller. {link} #openexhibits #sxsw,iPhone,"['#openexhibits', '#sxsw']"
0,time wakeuplaugh iphon appstor itun es ifr3dw,time wakeuplaughing iphone appstore itun e ifr3dw,RT @mention Time to #wakeuplaughing @mention for #iPhone is on the #AppStore! iTun.es/iFR3Dw #sxsw,,"['#wakeuplaughing', '#iPhone', '#AppStore', '#sxsw']"
0,kick sxswi give away ipad visit fb page enter,kick sxswi giving away ipad visit fb page enter,RT @mention To kick off #SXSWi @mention is giving away an iPad 2... Just visit the FB page to enter: {link} #SXSW,iPad,"['#SXSWi', '#SXSW']"
0,tron amaz idea blue ray releas 2nd screen ipad app sync movi follow addit content,tron amazing idea blue ray release 2nd screen ipad app syncs movie follow additional content,RT @mention TRON has an amazing idea for their blue ray release. 2nd screen ipad app that syncs with the movie to follow additional content. #SXSW,iPad or iPhone App,['#SXSW']
0,true rumor appl open temporari store downtown austin 4 ipad launch,true rumor apple opening temporary store downtown austin 4 ipad launch,RT @mention True? RT @mention It's not a rumor: Apple opening temporary store in downtown Austin 4 #SXSW &amp; iPad 2 launch: {link},Apple,['#SXSW']
0,tri steve wozniak drink free thank googl h4cker speakeasi,trying steve wozniak drink free thanks google h4ckers speakeasy,RT @mention Trying the Steve Wozniak drink free thanks to Google #H4ckers #SXSW   @mention Speakeasy {link},Google,"['#H4ckers', '#SXSW']"
0,turn ipad physic messag platform holler gram cheeki app built,turn ipad physical messaging platform holler gram cheeky app built,"RT @mention Turn your iPad into a 'physical messaging platform' with Holler Gram, a cheeky app we built for #SXSW. {link}",iPad or iPhone App,['#SXSW']
0,umm would keep win shit thank killer ipad case,umm would keep winning shit thanks killer ipad case,RT @mention umm that would be @mention ÛÏ@mention I keep winning shit! Thanks @mention for the killer iPad case. #sxswÛ,iPad,['#sxsw']
0,updat npr music iphon app song info songs4 7 live video stream time,updated npr music iphone app song info songs4 7 live video streaming time,RT @mention Updated NPR Music iPhone app has song info for All Songs 24/7 &amp; live video streaming just in time for #SXSW {link},iPad or iPhone App,['#SXSW']
0,v interest googl launch major new social network call circl possibl today,v interesting google launch major new social network called circle possibly today,"RT @mention V.Interesting... RT @mention Google to Launch Major New Social Network Called Circles, Possibly Today {link} #sxsw",Other Google product or service,['#sxsw']
0,happi discovr name one top ten must app ipad fight way thru queue,happy discovr named one top ten must apps ipad fight way thru queue,RT @mention Very happy that Discovr has been named as one of the top ten must-have apps for iPad 2 :) I just have to fight my way thru the queue! #sxsw,iPad or iPhone App,['#sxsw']
0,smart hollergram ipad app may leav vuvuzela home,smart hollergram ipad app may leave vuvuzela home,RT @mention Very smart from @mention #hollergram iPad app for #sxsw! {link} (may leave my vuvuzela at home now),iPad or iPhone App,"['#hollergram', '#sxsw']"
0,smart move appl pop store ipad come 5pm tomorrow,smart move apple pop store ipad come 5pm tomorrow,RT @mention Very smart move by Apple. A pop-up store during #SXSW (iPad 2's come out at 5pm tomorrow): {link},Apple,['#SXSW']
0,smart appl set open popup shop core action appl,smart apple set open popup shop core action apple,RT @mention Very smart of them. &quot;Apple set to open popup shop in core of SXSW action&quot; - {link} #sxsw #apple,,"['#sxsw', '#apple']"
0,smart aapl open pop store ipad sale,smart aapl open pop store ipad sale,RT @mention Very smart. RT @mention $AAPL to open pop up store for iPad 2 sales at #SXSW {link},Apple,['#SXSW']
0,via still big line outsid appl pop shop 3 day ipad debut,via still big line outside apple pop shop 3 day ipad debut,"RT @mention via @mention Still a big line outside of Apple's pop-up shop, 3 days after iPad's debut. #sxsw",Apple,['#sxsw']
0,video first ipad2 unbox outsid appl store come soon find decent wifi,video first ipad2 unboxing outside apple store coming soon find decent wifi,RT @mention Video of the first #iPad2 unboxing outside the #Apple Store at #SXSW coming up as soon as I can find decent WiFi,iPad,"['#iPad2', '#Apple', '#SXSW']"
0,vs vs thing heat googl offer check reward titl lb,v v thing heating google offer check reward title lb,So @mention vs @mention vs @mention at #SXSW. Things are heating up! &quot;Google offers check-in rewards &amp; titles&quot; {link} - #lbs,Google,"['#SXSW', '#lbs']"
0,w00t wrote hollergram ipad app,w00t wrote hollergram ipad app,RT @mention w00t! @mention wrote about our #hollergram iPad app for #sxsw! {link},iPad or iPhone App,"['#hollergram', '#sxsw']"
0,want win free ipad attend detail,want win free ipad attending detail,RT @mention Want to win a free #iPad 2? Are you at or attending #SXSW? Details are here: {link},,"['#iPad', '#SXSW']"
0,includ emot thing ipad barrydil pnid,including emotional thing ipad barrydiller pnid,"RT @mention We all, including me, have this emotional thing with iPad. #barrydiller #sxsw #pnid",iPad,"['#barrydiller', '#sxsw', '#pnid']"
0,excit see hl dynam video ad insert tv everywher work ipad2 later today popup appl store,excited see hl dynamic video ad insertion tv everywhere working ipad2 later today popup apple store,RT @mention We are excited to see HLS Dynamic Video Ad Insertion for TV Everywhere working on the #iPad2 later today at the #SXSW PopUp Apple Store,iPad,"['#iPad2', '#SXSW']"
0,wait give ipad someon want head www pep job upc enter must present win,wait give ipad someone want head www pep job upc enter must present win,RT @mention We can't wait to give an iPad to someone at #sxsw. Want in? Just head to www.pep.jobs/upc to enter. (must be present to win,iPad,['#sxsw']
0,launch ipad app get detail first edit free,launched ipad app get detail first edition free,RT @mention We just launched our iPad app at #SXSW! Get all the details + the first edition FREE: {link},iPad or iPhone App,['#SXSW']
0,launch spin ipad app ton music photo video whatcha think,launched spin ipad app ton music photo video whatcha think,RT @mention We just launched SPIN's iPad app at #SXSW. Tons of #music #photos #videos and more! Whatcha think? {link},iPad or iPhone App,"['#SXSW', '#music', '#photos', '#videos']"
0,lose hour tonight attende blame microsoft appl get credit fix christma,lose hour tonight attendee blame microsoft apple get credit fixing christmas,"RT @mention We lose an hour tonight. #SxSW attendees will blame Microsoft, Apple will get credit for fixing it before Christmas.",Apple,['#SxSW']
0,lose hour 2nite attende blame microsoft appl get credit 4 fix b4 christma,lose hour 2nite attendee blame microsoft apple get credit 4 fixing b4 christmas,"RT @mention We lose hour 2nite. #SxSW attendees will blame Microsoft, Apple will get credit 4 fixing it b4 Christmas.",Apple,['#SxSW']
0,lustr pearl teamandroidsxsw caus love android geek,lustre pearl teamandroidsxsw cause love android geek,RT @mention We're at Lustre Pearl for #teamandroidsxsw cause we love our Android geeks! #sxsw {link},Android,"['#teamandroidsxsw', '#sxsw']"
0,co host cmti mngr meetup w etsi austin space 6th 6 8p googl schwag come,co hosting cmty mngr meetup w etsy austin space 6th 6 8p google schwag come,RT @mention We're co-hosting a cmty mngr meetup w/ @mention @mention @mention at Etsy Austin space on 6th. 6-8p. Google schwag. Come! #sxsw,Google,['#sxsw']
0,excit giddi announc music withm android avail android market,excited giddy announce music withme android available android market,RT @mention We're excited to be at #sxsw and giddy to announce that Music WithMe for Android is now available in Android Market. {link},Android App,['#sxsw']
0,wonder mani come back ipad mayb everyon,wondering many come back ipad maybe everyone,RT @mention We're wondering how many @mention will come back from #sxsw with iPad 2's. Maybe everyone?,,['#sxsw']
0,got excit thing show year includ drag drop store manag iphon,got exciting thing showing year including drag drop store management iphone,RT @mention We've got some exciting things that we'll be showing off at #SXSW this year: including drag and drop store management on your iPhone,iPhone,['#SXSW']
