emotion,stems,lemmas,tweet,brand_product,hashtags
1,3g iphon 3 hr tweet rise austin dead need upgrad plugin station,3g iphone 3 hr tweeting rise austin dead need upgrade plugin station,".@wesley83 I have a 3G iPhone. After 3 hrs tweeting at #RISE_Austin, it was dead!  I need to upgrade. Plugin stations at #SXSW.",iPhone,"['#RISE_Austin', '#SXSW']"
0,know awesom ipad iphon app like appreci design also give free ts,know awesome ipad iphone app likely appreciate design also giving free t,"@jessedee Know about @fludapp ? Awesome iPad/iPhone app that you'll likely appreciate for its design. Also, they're giving free Ts at #SXSW",iPad or iPhone App,['#SXSW']
0,wait ipad also sale,wait ipad also sale,@swonderlin Can not wait for #iPad 2 also. They should sale them down at #SXSW.,iPad,"['#iPad', '#SXSW']"
1,hope year festiv crashi year iphon app,hope year festival crashy year iphone app,@sxsw I hope this year's festival isn't as crashy as this year's iPhone app. #sxsw,iPad or iPhone App,['#sxsw']
0,great stuff fri marissa mayer googl tim reilli tech book confer matt mullenweg wordpress,great stuff fri marissa mayer google tim reilly tech book conference matt mullenweg wordpress,"@sxtxstate great stuff on Fri #SXSW: Marissa Mayer (Google), Tim O'Reilly (tech books/conferences) &amp; Matt Mullenweg (Wordpress)",Google,['#SXSW']
0,start ctia around corner googleio hop skip jump good time android fan,starting ctia around corner googleio hop skip jump good time android fan,"#SXSW is just starting, #CTIA is around the corner and #googleio is only a hop skip and a jump from there, good time to be an #android fan",Android,"['#SXSW', '#CTIA', '#googleio', '#android']"
0,beauti smart simpl idea wrote hollergram ipad app,beautifully smart simple idea wrote hollergram ipad app,Beautifully smart and simple idea RT @madebymany @thenextweb wrote about our #hollergram iPad app for #sxsw! http://bit.ly/ieaVOB,iPad or iPhone App,"['#hollergram', '#sxsw']"
0,count day plu strong canadian dollar mean stock appl gear,counting day plus strong canadian dollar mean stock apple gear,Counting down the days to #sxsw plus strong Canadian dollar means stock up on Apple gear,Apple,['#sxsw']
0,excit meet show sprint galaxi still run android 1 fail,excited meet show sprint galaxy still running android 1 fail,Excited to meet the @samsungmobileus at #sxsw so I can show them my Sprint Galaxy S still running Android 2.1.   #fail,Android,"['#sxsw', '#fail']"
0,find start impromptu parti wait til android app come,find start impromptu party wait til android app come,Find &amp; Start Impromptu Parties at #SXSW With @HurricaneParty http://bit.ly/gVLrIn I can't wait til the Android app comes out.,Android App,['#SXSW']
0,foursquar up game time still prefer far best look android app date,foursquare ups game time still prefer far best looking android app date,"Foursquare ups the game, just in time for #SXSW http://j.mp/grN7pK) - Still prefer @Gowalla by far, best looking Android app to date.",Android App,['#SXSW']
0,gotta love googl calendar featur top parti show case check via,gotta love google calendar featuring top party show case check via,Gotta love this #SXSW Google Calendar featuring top parties/ show cases to check out.  RT @hamsandwich via @ischafer =&gt;http://bit.ly/aXZwxB,Other Google product or service,['#SXSW']
0,great ipad app,great ipad app,Great #sxsw ipad app from @madebymany: http://tinyurl.com/4nqv92l,iPad or iPhone App,['#sxsw']
0,haha awesom rad ipad app hollergram,haha awesomely rad ipad app hollergram,"haha, awesomely rad iPad app by @madebymany http://bit.ly/hTdFim #hollergram #sxsw",iPad or iPhone App,"['#hollergram', '#sxsw']"
1,notic dst come weekend mani iphon user hour late come sunday morn iphon,noticed dst coming weekend many iphone user hour late come sunday morning iphone,I just noticed DST is coming this weekend. How many iPhone users will be an hour late at SXSW come Sunday morning? #SXSW #iPhone,iPhone,"['#SXSW', '#iPhone']"
0,ad flight match peopl plane airport also download iphon app nice done,added flight matching people plane airport also downloaded iphone app nicely done,"Just added my #SXSW flights to @planely. Matching people on planes/airports. Also downloaded the @KLM iPhone app, nicely done.",iPad or iPhone App,['#SXSW']
0,must app love review forb ipad app holler gram,must app lovely review forbes ipad app holler gram,Must have #SXSW app! RT @malbonster: Lovely review from Forbes for our SXSW iPad app Holler Gram - http://t.co/g4GZypV,iPad or iPhone App,['#SXSW']
0,need buy ipad2 austin sure need q austin appl store,need buy ipad2 austin sure need q austin apple store,Need to buy an iPad2 while I'm in Austin at #sxsw. Not sure if I'll need to Q up at an Austin Apple store?,iPad,['#sxsw']
0,oh god app ipad pure unadulter awesom easier brows event ipad websit,oh god app ipad pure unadulterated awesome easier browse event ipad website,"Oh. My. God. The #SXSW app for iPad is pure, unadulterated awesome. It's easier to browse events on iPad than on the website!!!",iPad or iPhone App,['#SXSW']
0,okay realli yay new android app 11 kthxbai,okay really yay new android app 11 kthxbai,"Okay, this is really it: yay new @Foursquare for #Android app!!!!11 kthxbai. #sxsw",Android App,"['#Android', '#sxsw']"
0,photo instal iphon app realli nice,photo installed iphone app really nice,"Photo: Just installed the #SXSW iPhone app, which is really nice! http://tumblr.com/x6t1pi6av7",iPad or iPhone App,['#SXSW']
0,realli enjoy chang gowalla 3 0 android look forward see els foursquar sleev,really enjoying change gowalla 3 0 android looking forward seeing else foursquare sleeve,Really enjoying the changes in Gowalla 3.0 for Android! Looking forward to seeing what else they &amp; Foursquare have up their sleeves at #SXSW,Android App,['#SXSW']
0,look forward smcdalla pre parti wed hope win ipad result shameless promot chevysmc,looking forward smcdallas pre party wed hoping win ipad resulting shameless promotion chevysmc,"RT @LaurieShook: I'm looking forward to the #SMCDallas pre #SXSW party Wed., and hoping I'll win an #iPad resulting from my shameless promotion.  #ChevySMC",iPad,"['#SMCDallas', '#SXSW', '#iPad', '#ChevySMC']"
0,haha awesom rad ipad app hollergram via,haha awesomely rad ipad app hollergram via,"RT haha, awesomely rad iPad app by @madebymany http://bit.ly/hTdFim #hollergram #sxsw (via @michaelpiliero)",iPad or iPhone App,"['#hollergram', '#sxsw']"
0,someon start austin group googl group pre great idea,someone started austin group google group pre great idea,"someone started an #austin @PartnerHub group in google groups, pre-#sxsw. great idea",Other Google product or service,"['#austin', '#sxsw']"
0,new 4sq3 look like go rock updat iphon android push tonight keepaustinweird,new 4sq3 look like going rock update iphone android push tonight keepaustinweird,The new #4sq3 looks like it is going to rock. Update for iPhone and Android should push tonight http://bit.ly/etsbZk #SXSW #KeepAustinWeird,iPad or iPhone App,"['#4sq3', '#SXSW', '#KeepAustinWeird']"
0,right 3 app android sweeeeet nice job team,right 3 app android sweeeeet nice job team,"They were right, the @gowalla 3 app on #android is sweeeeet! Nice job by the team there. #sxsw",Android App,"['#android', '#sxsw']"
0,smart hollergram ipad app may leav vuvuzela home,smart hollergram ipad app may leave vuvuzela home,Very smart from @madebymany #hollergram iPad app for #sxsw! http://t.co/A3xvWc6 (may leave my vuvuzela at home now),iPad or iPhone App,"['#hollergram', '#sxsw']"
0,must app ipad go hollergram,must app ipad going hollergram,You must have this app for your iPad if you are going to #SXSW http://itunes.apple.com/us/app/holler-gram/id420666439?mt=8 #hollergram,iPad or iPhone App,"['#SXSW', '#hollergram']"
0,best ha first line ipad2 pop appl store event planner eventprof pcma engage365,best ha first line ipad2 pop apple store event planner eventprofs pcma engage365,The best!  RT @mention Ha! First in line for #ipad2 at #sxsw &quot;pop-up&quot; Apple store was an event planner #eventprofs #pcma #engage365,iPad,"['#ipad2', '#sxsw', '#eventprofs', '#pcma', '#engage365']"
1,fals alarm googl circl come probabl ever googl circl social,false alarm google circle coming probably ever google circle social,@mention  - False Alarm: Google Circles Not Coming NowÛÒand Probably Not Ever? - {link} #Google #Circles #Social #SXSW,Google,"['#Google', '#Circles', '#Social', '#SXSW']"
0,great weather greet still need sweater night appl put flash store downtown sell ipad2,great weather greet still need sweater night apple putting flash store downtown sell ipad2,@mention  - Great weather to greet you for #sxsw! Still need a sweater at night..Apple putting up &quot;flash store&quot; downtown to sell iPad2,Apple,['#sxsw']
0,ipad2 smartcov open instant access wait get one appl,ipad2 smartcover open instant access waited get one apple,#IPad2 's Û÷#SmartCoverÛª Opens to Instant Access - I should have waited to get one! - {link} #apple #SXSW,iPad or iPhone App,"['#IPad2', '#SmartCover', '#apple', '#SXSW']"
0,hand held hobo drafthous launch hobo shotgun iphon app,hand held hobo drafthouse launch hobo shotgun iphone app,Hand-Held Û÷HoboÛª: Drafthouse launches Û÷Hobo With a ShotgunÛª iPhone app #SXSW {link},,['#SXSW']
0,hooray appl open pop store austin,hooray apple opening pop store austin,HOORAY RT ÛÏ@mention Apple Is Opening A Pop-Up Store In Austin For #SXSW | @mention {link},Apple,['#SXSW']
0,wooooo appl store downtown austin open til midnight,wooooo apple store downtown austin open til midnight,wooooo!!! ÛÏ@mention Apple store downtown Austin open til Midnight. #sxswÛ,Apple,['#sxsw']
0,talk googl effort allow user open system bettercloud,talking google effort allow user open system bettercloud,ÛÏ@mention @mention talking about {link} - Google's effort to allow users to have open systems #bettercloud #sxswÛ,Google,"['#bettercloud', '#sxsw']"
0,1st stop chao hunt austin java get spi game 4 chanc win ipad,1st stop chaos hunt austin java get spy game 4 chance win ipad,{link} RT @mention 1st stop on the #SXSW #Chaos &amp; @mention hunt: Austin Java. Get in the spy game 4 a chance 2 win an iPad!,iPad,"['#SXSW', '#Chaos']"
0,omfg heard appl pop store downtown austin pic alreadi gowalla ipad2,omfg heard apple pop store downtown austin pic already gowalla ipad2,#OMFG! RT @mention Heard about Apple's pop-up store in downtown Austin? Pics are already on Gowalla: {link} #sxsw #iPad2,Apple,"['#OMFG', '#sxsw', '#iPad2']"
1,line appl store insan,line apple store insane,Again? RT @mention Line at the Apple store is insane.. #sxsw,,['#sxsw']
1,attend ipad design headach,attending ipad design headache,attending @mention iPad design headaches #sxsw {link},iPad,['#sxsw']
1,boooo flipboard develop iphon version android say,boooo flipboard developing iphone version android say,"Boooo! RT @mention Flipboard is developing an iPhone version, not Android, says @mention #sxsw",,['#sxsw']
0,check line ipad austin power sxswi,check line ipad austin power sxswi,Check out @mention @mention &amp; @mention in line for their iPad 2 in Austin. Power to them! #sxswi #SXSW  {link},iPad,"['#sxswi', '#SXSW']"
0,come parti w googl tonight band food art ice cream nifti interact map,come party w google tonight band food art ice cream nifty interactive map,"Do it. RT @mention Come party w/ Google tonight at #sxsw! {link} - Bands, food, art, ice cream, nifty interactive maps!",Google,['#sxsw']
0,holla googl parti best ever get butt,holla google party best ever get butt,Holla! RT @mention At google party. Best ever! Get your butt over here. #sxsw,Google,['#sxsw']
0,love iphon case get phone fail,love iphone case get phone fail,I love my @mention iPhone case from #Sxsw but I can't get my phone out of it #fail,iPhone,"['#Sxsw', '#fail']"
0,new post iphon app make easi connect social network peopl meet,new post iphone app make easy connect social network people meet,New Post: @mention iPhone app makes it easy to connect on all social networks with people you meet  {link} #sxsw,iPad or iPhone App,['#sxsw']
0,nice iphon app behav today crash yesterday ridicul,nice iphone app behaving today crash yesterday ridiculous,Nice that @mention iPhone app is behaving today. Crashes yesterday were ridiculous. #sxsw,iPad or iPhone App,['#sxsw']
0,nice hey appl fan get peek space slate pop appl store tomorrow,nice hey apple fan get peek space slated pop apple store tomorrow,"Nice!! RT @mention Hey, Apple fans! Get a peek at the space that's slated to be a pop-up #SXSW Apple Store tomorrow: {link}",Apple,['#SXSW']
0,one thing great get great earth face googl compani love sxwsi,one thing great get great earth face google company love sxwsi,"one thing @mention is doing so great is get a great, down to earth face to Google as a company - You can only love her #sxsw #sxwsi",Google,"['#sxsw', '#sxwsi']"
0,thank mention new speech ipad app showcas conf sxswh sxsh,thanks mention new speech ipad apps showcased conf sxswh sxsh,Thanks to @mention for her mention of our new #Speech iPad apps being showcased at the #SXSW Conf. {link} #sxswh #sxsh,iPad or iPhone App,"['#Speech', '#SXSW', '#sxswh', '#sxsh']"
1,provid iphon charger chang mind go next year,provide iphone charger changed mind going next year,What !?!? @mention  #SXSW does not provide iPhone chargers?!?  I've changed my mind about going next year!,iPhone,['#SXSW']
0,xma shini new app new book pop ipad store christma nerd,xmas shiny new apps new book pop ipad store christmas nerd,"XMAS!! RT @mention Shiny new @mention @mention @mention apps, a new @garyvee book, pop-up iPad 2 stores... #SXSW is Christmas for nerds.",iPad,['#SXSW']
0,yai new ubersoci iphon app store includ uberguid sponsor cont,yai new ubersocial iphone app store includes uberguide sponsored cont,Yai!!! RT @mention New #UberSocial for #iPhone now in the App Store includes UberGuide to #SXSW sponsored by (cont) {link},iPhone,"['#UberSocial', '#iPhone', '#SXSW']"
0,fast fun futur googl present search local mobil,fast fun future google presenting search local mobile,"Fast, Fun &amp; Future: @mention of Google presenting at #sxsw on search, local and mobile",Google,['#sxsw']
0,headlin ipad must gadget hmm could seen one come gadget,headline ipad must gadget hmm could seen one coming gadget,Headline: &quot;#iPad 2 is the Must-Have Gadget at #SXSW&quot; Hmm... I could have seen that one coming! {link} #gadget,iPad,"['#iPad', '#SXSW', '#gadget']"
1,know dataviz translat satan iphon sayin,know dataviz translates satanic iphone sayin,Know that &quot;dataviz&quot; translates to &quot;satanic&quot; on an iPhone. I'm just sayin'. #sxsw,,['#sxsw']
0,googl launch checkin month ago check in ok check out futur bizzi,google launched checkins month ago check in ok check out future bizzy,".@mention &quot;Google launched checkins a month ago.&quot; Check ins are ok, but CHECK OUTS are the future. #sxsw #Bizzy",Google,"['#sxsw', '#Bizzy']"
0,googl tweet new think speak mark belinski 911tweet panel,google tweet new think speak mark belinsky 911tweets panel,"ÛÏ@mention &quot;Google before you tweet&quot; is the new &quot;think before you speak.&quot; - Mark Belinsky, #911tweets panel at #SXSW.Û",Google,"['#911tweets', '#SXSW']"
0,kawasaki c lewi level reason appl continu exist evid exist god bawl,kawasaki c lewis level reasoning apple continued existence evidence existence god bawling,"Kawasaki: &quot;Not C.S. Lewis level reasoning, but Apple's continued existence is evidence for the existence of God&quot; #bawling #sxsw",Apple,"['#bawling', '#sxsw']"
0,kawasaki pagemak save appl oh day jwtatl enchant via,kawasaki pagemaker saved apple oh day jwtatl enchantment via,Kawasaki: &quot;pagemaker saved Apple.&quot; Oh those were the days. #sxsw #jwtatl #enchantment  via @mention,Apple,"['#sxsw', '#jwtatl', '#enchantment']"
0,spark android teamandroid award read,spark android teamandroid award read,Spark for #android is up for a #teamandroid award at #SXSW read about it here: {link},,"['#android', '#teamandroid', '#SXSW']"
0,appl ipad great thought w japan apac region deal w earthquak tsunami trauma sxswi,apple ipad great thought w japan apac region dealing w earthquake tsunami trauma sxswi,"#SXSW and #Apple iPad 2's are great, but thoughts are w/ Japan and APAC regions dealing w/ earthquake &amp; tsunami trauma. #sxswi",iPad,"['#SXSW', '#Apple', '#sxswi']"
0,appl school market expert,apple school marketing expert,"At #SXSW, #Apple schools the marketing experts - {link}",Apple,"['#SXSW', '#Apple']"
0,temporari appl store def tent powerhous gym,temporary apple store def tent powerhouse gym,"Temporary #apple store is def not a tent, it's a powerhouse gym #SXSW  {link}",Apple,"['#apple', '#SXSW']"
0,temporari appl store 6th congress along 10 000 happi hipster,temporary apple store 6th congress along 10 000 happy hipster,"Temporary #Apple store on 6th and Congress for #sxsw, along with 10,000 very happy hipsters.",Apple,"['#Apple', '#sxsw']"
0,appl win open temporari store downtown austin support ipad2 launch good,apple win opening temporary store downtown austin support ipad2 launch good,ÛÏ@mention #Apple wins #SXSW {link} Opening a temporary store in downtown Austin to support #iPad2 launch - That is good.,Apple,"['#Apple', '#SXSW', '#iPad2']"
0,ipad austin trend today fun nerdi nerd,ipad austin trending today fun nerdy nerd,#iPad and #Austin are trending today. Have fun at #sxsw all you nerdy nerds!!!,iPad,"['#iPad', '#Austin', '#sxsw']"
0,christian ipad iphon dev want talk u mayb wk togeth cool app,christian ipad iphone devs want talk u maybe wk together cool app,Christian #iPad #iPhone devs I want to talk to u at #sxsw or after -maybe we can wk together on cool app! @mention me,iPad or iPhone App,"['#iPad', '#iPhone', '#sxsw']"
0,appl ipad2 taken austin storm excit part mobil,apple ipad2 taken austin storm excited part mobile,The Apple #iPAD2  has taken #SxSW and #Austin by storm.. {link}  @mention excited to a be a part #mobile,iPad,"['#iPAD2', '#SxSW', '#Austin', '#mobile']"
0,haz ipad2 ifrom gr8,haz ipad2 ifrom gr8,I can haz #iPad2 ifrom #SxSW Gr8 {link},iPad,"['#iPad2', '#SxSW']"
0,stack ipad2 wait bought got mine hassl appl handl perfectli,stack ipad2 waiting bought got mine hassle apple handled perfectly,"Stacks of #ipad2's waiting to be bought at #sxsw. I got mine, no hassle at all. Apple handled this perfectly {link}",iPad,"['#ipad2', '#sxsw']"
0,smallbiz need review play googl place got app seo,smallbiz need review play google place got app seo,Does your #SmallBiz need reviews to play on Google Places...We got an App for that..{link}  #seo #sxsw,,"['#SmallBiz', '#seo', '#sxsw']"
0,take major south korean director get 130 000 make movi entir iphon,take major south korean director get 130 000 make movie entirely iphone,"Take that #SXSW ! RT @mention Major South Korean director gets $130,000 to make a movie entirely with his iPhone. {link}",iPhone,['#SXSW']
0,beauti appl store pic,beautiful apple store pic,"Beautiful #sxsw (@mention Apple Store, SXSW) [pic]: {link}",Apple,['#sxsw']
0,must app love review forb ipad app holler gram,must app lovely review forbes ipad app holler gram,Must have #SXSW app! RT @mention Lovely review from Forbes for our SXSW iPad app Holler Gram - {link},iPad or iPhone App,['#SXSW']
0,temporari appl store appl sneaki usual,temporary apple store apple sneaky usual,Temporary #sxsw apple store. Apple being sneaky as usual  {link},Apple,['#sxsw']
0,beta test interact book ipad app moonbot studio louisiana cool app,beta testing interactive book ipad app moonbot studio louisiana cool app,ÛÏ@mention #sxsw beta testing interactive book for iPad app by Moonbot studios out of Louisiana.  Cool app.Û,iPad or iPhone App,['#sxsw']
0,appl day one see ton ipad2,apple day one seeing ton ipad2,Apple won #SxSW from day one. Seeing a TON of #iPad2,iPad,"['#SxSW', '#iPad2']"
0,ipad store sold everyth except 64gig wifi white manag get,ipad store sold everything except 64gig wifi white manage get,ÛÏ@mention #sxsw ipad store sold out of everything except 64gig wifi only whiteÛ @mention Did you manage to get yours?,iPad,['#sxsw']
0,ipad store sold everyth except 64gig wifi white also known white jean configur,ipad store sold everything except 64gig wifi white also known white jean configuration,ÛÏ@mention #sxsw ipad store sold out of everything except 64gig wifi only whiteÛ also known as the white jeans configuration.,iPad,['#sxsw']
0,offer ipad promo ninjafind user fan suck,offered ipad promo ninjafinder user fan suck,Offered a #sxsw ipad promo to ninjafinder users and fans who are not here at #sxsw. Sucks to not be here. #sxsw,iPad,"['#sxsw', '#sxsw', '#sxsw']"
0,poursit learn life chang impact ipad real peopl actual live bravo,poursite learning life changing impact ipad real people actual life bravo,#POURsite #SXSW learning about the life-changing impact of the iPad on real people's actual lives - bravo!,iPad,"['#POURsite', '#SXSW']"
0,lonelyplanet austin guid iphon free limit time lp travel,lonelyplanet austin guide iphone free limited time lp travel,@mention  #SXSW LonelyPlanet Austin guide for #iPhone is free for a limited time {link} #lp #travel,,"['#SXSW', '#iPhone', '#lp', '#travel']"
0,appl store still ipad short line,apple store still ipad short line,The Apple #SXSW store still has iPad 2's and short lines.,iPad,['#SXSW']
0,left tradeshow demo googl theatr ok get see present use,left tradeshow demo google theatre ok get see presenter using,"Just left #sxsw tradeshow demo of @mention at the Google Theatre. Ok, I get it. I see why all the presenters here are using it.",Other Google product or service,['#sxsw']
0,anyon want make quick hundr dollar new ipad2 ad hoc appl store get hundr plu cost,anyone want make quick hundred dollar new ipad2 ad hoc apple store get hundred plus cost,Anyone at #sxsw want to make a quick hundred dollars? New #ipad2 from ad hoc apple store here gets hundred plus cost!,iPad,"['#sxsw', '#ipad2']"
0,monday barri diller new york time congress lunch w hotel parti googl parti six dirti martini monday,monday barry diller new york time congress lunch w hotel party google party six dirty martini monday,"Monday at #sxsw: barry diller, new york times, congress lunch, W Hotel party, Google party, six dirty martinis. How mondays should be.",Google,['#sxsw']
1,serious test mobil app constant ipad crash caus lost schedul sync wp7,seriously testing mobile apps constant ipad crash causing lost schedule sync wp7,"Seriously #sxsw? Did you do any testing on the mobile apps? Constant iPad crashes causing lost schedules, and no sync for WP7.",iPad or iPhone App,['#sxsw']
0,readi iphon app make ur blog easier sxswi,ready iphone apps make ur blogging easier sxswi,Ready for #SXSW?! Here are some iPhone apps 2 make ur blogging easier | {link} #SXSW #SXSWi,iPad or iPhone App,"['#SXSW', '#SXSW', '#SXSWi']"
1,ipad2 conflagr doofus,ipad2 conflagration doofusness,ipad2 and #sxsw...a conflagration of doofusness.  {link},iPad,['#sxsw']
0,attent er rumor pop temporari appl store ipad launch need,attention er rumored pop temporary apple store ipad launch need,attention #sxsw'ers - {link} - rumored pop-up temporary Apple store for all your #sxsw iPad 2 launch needs.,Apple,"['#sxsw', '#sxsw']"
0,went sxswi lousi ipad,went sxswi lousy ipad,I went to #sxswi and all I won was this lousy #iPad #sxsw :-) :-) {link},iPad,"['#sxswi', '#iPad', '#sxsw']"
0,win pictur android googl,winning picture android google,This is a #WINNING picture #android #google #sxsw {link},Android,"['#WINNING', '#android', '#google', '#sxsw']"
1,spent 1 000 come alreadi use ipad 1 wait coupl citi block ipad2,spent 1 000 come already used ipad 1 wait couple city block ipad2,"You spent $1,000+ to come to SXSW. 

You've already used iPad 1. 

The wait is a couple city blocks. 

Why? #ipad2 #SXSW {link}",iPad,"['#ipad2', '#SXSW']"
0,behind 100 email give 1 line iphon compos repli protip,behind 100 email give 1 line iphone composed reply protip,Behind on 100s of emails? Give them all 1 line iPhone composed replies. #SXSW #protip,iPhone,"['#SXSW', '#protip']"
0,like 10pm night line around block popup appl store sell ipad2,like 10pm night line around block popup apple store selling ipad2s,It's like 10pm at night and there is a line around the block at the popup apple stores selling iPad2s. #sxsw,iPad,['#sxsw']
1,ipad 2s seen wild peopl say fast still pic terribl,ipad 2 seen wild people say fast still pic terrible,"I'm up to 2 iPad 2s seen in the wild. Both people say it is fast, but the still pics are terrible. #sxsw",iPad,['#sxsw']
0,ipad take video,ipad take video,The #iPad 2 Takes Over #SXSW [VIDEO] /by @mention {link},iPad,"['#iPad', '#SXSW']"
0,mani ipad snap away keynot slide,many ipad snapping away keynote slide,many iPad 2's snapping away at the keynote slides! #sxsw,iPad,['#sxsw']
0,new post 3 iphon app use south southwest interact sxswi,new post 3 iphone apps using south southwest interactive sxswi,New Post: 3 iPhone Apps We'll Be Using at South By Southwest Interactive {link} #SXSW #SXSWi,iPad or iPhone App,"['#SXSW', '#SXSWi']"
0,sweet new 3 googl map demo go ballroom,sweet new 3 google map demo going ballroom,sweet new 3-d google maps demo going on in ballroom D #SXSW,Other Google product or service,['#SXSW']
0,35 million mile per day drive googl map navig,35 million mile per day driving google map navigation,More than 35 million miles per day are driving with Google Maps Navigation! #SXSW,Other Google product or service,['#SXSW']
0,day 5 appl store still line grow,day 5 apple store still line growing,#SXSW day 5 at the #apple store and there's still a line...and growing {link},Apple,"['#SXSW', '#apple']"
